"text","label_id","label"
"현재 페이지에서 장바꾸니에서 첫 번째 상품 체크해 부탁드립니다","84","select_cart_item"
"지금 화면에서 장바구니조회해줘 해주이소","71","click_cart"
"지금화면에서일단최종결재금액읽어줘해주세요","87","read_order_amount"
"급한데총결재금액얼마야 지금","87","read_order_amount"
"내일 버스 시간 계산해줘","0","unknown"
"방금 본 상품 기준으로 이번엔 검샥 결과 읽어줘 좀","75","read_search_results"
"이 상품 즉시 주문할래 부탁해","80","click_buy_now"
"잠깐 택배 조회 화면 열어줘 해줄래","92","click_track_delivery"
"이번 주문 기준으로 이 페이지에서 다음으로 뭐 할 수 있어","74","read_current_page_actions"
"먼저 이 주문 반품 요청할게 부탁해 먼저","93","request_exchange_return"
"바로별점낮은리뷰부터보여줘해줘해주이소","81","read_reviews"
"이번엔 별점 낮은 리부부터 보여줘 해줘 먼저","81","read_reviews"
"먼저 이 페이지 가능한 작업 목록 보여줘 좀","74","read_current_page_actions"
"이번 주문 기준으로 배송비 포함 금액 읽어줘 해줄래","87","read_order_amount"
"이번 주문 기준으로 먼저 검색 결과 중 할인 붙은 거 골라줘 부탁드립니다","76","select_search_result"
"현재 페이지에서 결과 페이지내용 읽어줘 부탁드립니다","75","read_search_results"
"이번 주문 기준으로 이거 찜 목록에 담아 가능해 먼저","82","click_wishlist"
"지금 화면에서 이번엔 최근 주문내역 보게 이동해줘","70","click_order_history"
"급한데 이 상품 옵션 항목 설명해줘","95","read_option_info"
"지금 바로 결재 화면 가자 해줘","80","click_buy_now"
"일단 히어비 메인 페이지로 전환해줘","68","go_hearbe"
"이번 주문 기준으로 먼저 카트 항목 선택해 지금","84","select_cart_item"
"일단 히어비 홈 탭으로 넘어가 해봐","68","go_hearbe"
"일단 배송 추적페이지로 가줘","92","click_track_delivery"
"지금 주문 상세 내역 설명해줘 부탁해","91","read_order_detail"
"별점 낮은 리뷰부터 보여줘 해주이소","81","read_reviews"
"바로 카트 페이지로 이동해 해주이소","71","click_cart"
"주문번호 기준으로 상세 보여줘 해봐","91","read_order_detail"
"주문 금액 읽어줘 해주세요","87","read_order_amount"
"이번엔 주문 상세 내역 설명해주이소해줘 바로","91","read_order_detail"
"방금본상픔기준으로잠깐담긴물건들가격같이알려줘해줘부탁","83","read_cart_items"
"현재페이지에서바로빠른구매로진행해줘부탁드립니다해봐","80","click_buy_now"
"먼저 이 상품 즉시 주문할래 부탁","80","click_buy_now"
"로그아웃 버튼 눌러주세요","73","click_logout"
"택배 어디쯤인지 조회해주라 부탁해 지금","92","click_track_delivery"
"이번 주문 기준으로 지금 바로결재할게 해줘 지금","89","submit_payment"
"현재 페이지에서 바로 하트 버튼 눌러줘 부탁해","82","click_wishlist"
"검색된 상품 목록 확인해줘","75","read_search_results"
"이번엔 로긴 창 띄워줘 해줄래","72","click_login"
"현재 페이지에서 먼저 한 번에 구매하기 눌러","80","click_buy_now"
"현재 페이지에서 이번엔 주문 배송 조회 메뉴 눌러줘 해줄래 부탁","70","click_order_history"
"잠깐 어떤 상품 결제하는지 읽어줘 가능해","88","read_payment_order_info"
"이번 주문 기준으로 히어비로 되돌아가 해줄래","68","go_hearbe"
"현재페이지에서장바구니내용확인해줘해봐","83","read_cart_items"
"급한데 카트로 바로 가 먼저","71","click_cart"
"방금 본 상픔 기준으로 이번엔 검색 결과를 하나씩 불러줘 부탁해","75","read_search_results"
"급한데 색상 사이즈 옵선 읽어줘 해줘","95","read_option_info"
"지금 삭제 요청 실행해줘 바로","94","delete_order_history"
"잠깐 결재하기 눌러줘 좀","89","submit_payment"
"지금 히어비 첫 화면으로 보내줘 해줘 바로","68","go_hearbe"
"바로 한 번 담아둘게 장바구니 추가 가능해","79","click_add_to_cart"
"지금 화면에서 두 번째 상픔만 선택해줘 좀 부탁","84","select_cart_item"
"위시리스트 추가해주세요","82","click_wishlist"
"현재 페이지에서 가능한 작업 알려줘 부탁해 지금","74","read_current_page_actions"
"지금 화면에서 가격 제일 낮은 결과 선택해주세요 해줘","76","select_search_result"
"급한데옵선정보읽어줘해줄래","95","read_option_info"
"현재페이지에서먼저결과화면요약해줘해줄래해봐","75","read_search_results"
"사이즈를 이 칠 영으로 바꿔줘가능해","78","update_product_option"
"현재 페이지에서 선택 버튼 눌러줘 해줘 바로","84","select_cart_item"
"방금 본 상픔 기준으로 먼저 지금 결제 진행해 가능해","89","submit_payment"
"이번엔 장바구니 항목전부 보여줘 부탁해","83","read_cart_items"
"이거 말고 다른 색상 있는지 검색해줘","69","search_products"
"카트 항목 선택해 부탁드립니다","84","select_cart_item"
"현재페이지에서검색결과에서눈에띄는것읽어줘바로","75","read_search_results"
"현재 페이지에서 급한데 이 상품 옵션 종류 뭐 있어 해봐","95","read_option_info"
"저녁버스시간체크해줘","0","unknown"
"현재 페이지에서 급한데 별점 낮은 리뷰부터 보여줘","81","read_reviews"
"방금 본 상품 기준으로 이번엔 자동로그인 해제하고 로그아웃해 좀 부탁","73","click_logout"
"다음 주 날씨 알려줘","0","unknown"
"위시리스트에추가해부탁해","82","click_wishlist"
"방금 본 상품 기준으로 지금 페이지 안내해줘","74","read_current_page_actions"
"지금 화면에서 장바구니 조회해줘 해줄래","71","click_cart"
"바로 지난 주문 확인 화면으로 이동해 해줄래","70","click_order_history"
"다음주회의시간체크해줘","0","unknown"
"현재 페이지에서 먼저 로긴 창 띄워줘 부탁드립니다","72","click_login"
"장바구니 탭 눌러줘","71","click_cart"
"이번 주문 기준으로 지금 제품 소개 문구 읽어줘","77","read_product_info"
"지금 화면에서 급한데상품 상세 설명 알려줘 좀 지금","77","read_product_info"
"어떤 상품 몇 개 샀는지 알려줘","91","read_order_detail"
"이번 주문 기준으로 먼저 먼저 로그인부터 할게 부탁드립니다 해봐","72","click_login"
"쿠팡에서 비타민 찾아봐 부탁드립니다","69","search_products"
"지금 화면에서 먼저 주문 상세 내역 설명해줘 해줄래","91","read_order_detail"
"현재 페이지에서 먼저 장바꾸니에서 첫 번째 상픔 체크해 해주세요 해봐","84","select_cart_item"
"현재 페이지에서 먼저 내가 시킨 것들 보이는 페이지로 가","70","click_order_history"
"지금 화면에서 지금 옵션 그대로 장바구니 담아줘 해줄래","79","click_add_to_cart"
"방금 본 상품 기준으로 먼저 바로 로그인해 좀 해주이소","72","click_login"
"방금 본 상품 기준으로 바로 첫 번째 항목 선택 취소해 해줘 먼저","85","unselect_cart_item"
"현재 페이지에서 가능한 작업 알려줘 좀","74","read_current_page_actions"
"이번엔 더 이상 안 보이게 삭제해줘 해줘","94","delete_order_history"
"지금 화면에서 일단 로그아웃 버튼 눌러줘 부탁해","73","click_logout"
"지금 화면에서 이번엔 로그아웃해주이소 부탁드립니다","73","click_logout"
"지금 특정 상품만 골라줘 가능해 지금","84","select_cart_item"
"바로 생수 검샥해줘 부탁드립니다","69","search_products"
"이번엔 결제 단계 마무리해줘 해주세요","89","submit_payment"
"다음 주 공부 계획 계산해줘","0","unknown"
"이번주문기준으로일단주문목록에서이항목삭제해","94","delete_order_history"
"바로 주문 정보읽어줘","88","read_payment_order_info"
"지금 결제 예정 금액 말해줘 먼저","87","read_order_amount"
"지금 화면에서 장바구니열어줘","71","click_cart"
"배송단계확인해줘","92","click_track_delivery"
"지금화면에서지금장바꾸니조회해줘부탁드립니다바로","71","click_cart"
"잠깐 결제 화면 항목들 설명해줘 좀","88","read_payment_order_info"
"지금 화면에서 주문 상세 페이지 내용 읽어줘 지금","91","read_order_detail"
"교환 요청 페이지 열어줘 좀","93","request_exchange_return"
"이번 주문 기준으로 지금 로그인 단계로 넘어가 부탁해","72","click_login"
"먼저 일인용 전기포트 검샥해 부탁드립니다","69","search_products"
"이번 주문 기준으로 옵선 로 변경해주라 지금","78","update_product_option"
"배송 진행상황눌러줘","92","click_track_delivery"
"일단 교환 처리 시작해줘 해주세요 해봐","93","request_exchange_return"
"이번엔 담긴 물건들 가격같이 알려줘","83","read_cart_items"
"방금 본상픔 기준으로 잠깐 주문 정보 읽어줘 해줄래 부탁","88","read_payment_order_info"
"방금 본 상품 기준으로 일단 지금 결재로 넘어가","80","click_buy_now"
"다음 주 수면 기록 계산해줘","0","unknown"
"바로 지금 검샥 결과 몇 개인지랑 같이 읽어주세요","75","read_search_results"
"지금 화면에서 지금 이거 말고 다른 색상 있는지 검샥해줘 해줘 먼저","69","search_products"
"지금 주문 정보 읽어줘 부탁드립니다","88","read_payment_order_info"
"같은 상품 장바구니에 추가해","79","click_add_to_cart"
"먼저 배송 추적 페이지로 가줘 해주세요 지금","92","click_track_delivery"
"방금 검샥한 목록에서 맨 위 상픔 들어가 좀 바로","76","select_search_result"
"오후버스시간알려줘","0","unknown"
"현재 페이지에서 옵선 그대로 장바꾸니 담아줘","79","click_add_to_cart"
"이번 주문 기준으로 일단 찜해둘게 부탁해","82","click_wishlist"
"오늘 버스 시간 요약해줘","0","unknown"
"먼저 옵션 선택 전에 정보 먼저 읽어줘 해줘","95","read_option_info"
"이번주문기준으로이번엔옵션말고기본정보먼저읽어줘","77","read_product_info"
"이번 주문 기준으로 현재 페이지에서 가능한 작업 알려줘 해주이소","74","read_current_page_actions"
"잠깐 이 상품 선택해줘","84","select_cart_item"
"지금 주문 건 세부 내용 읽어주라 해줄래","91","read_order_detail"
"지금 화면에서 이 상품선택해줘","84","select_cart_item"
"현재 페이지에서 먼저 옵션 그대로 장바구니 담아줘","79","click_add_to_cart"
"이번 주문 기준으로 바로 주문내옉 정리하려고 이거 삭제해 먼저","94","delete_order_history"
"지금 화면에서 지금 지금 검색 결과 몇 개인지랑 같이 읽어줘","75","read_search_results"
"잠깐 로긴 창 띄워줘","72","click_login"
"지금검샥결과몇개인지랑같이읽어주세요해줘","75","read_search_results"
"택배 어디쯤인지 조회해줘 해줘","92","click_track_delivery"
"현재페이지에서급한데두번째상품만선택해줘부탁해","84","select_cart_item"
"최근 주문내역보게 이동해줘 해줘","70","click_order_history"
"먼저로가웃버튼눌러줘바로","73","click_logout"
"주문 상세 페이지 내용 읽어줘 해봐","91","read_order_detail"
"지금 화면에서 급한데 주문 요약 정보 말해주세요 부탁해","88","read_payment_order_info"
"히어비 홈 탭으로 넘어가","68","go_hearbe"
"옵션 로 변경해줘 해주세요","78","update_product_option"
"현재 페이지에서 장바구니 페이지 열기 가능해","71","click_cart"
"현재 페이지에서 일단 즉시 구매 진행해줘","80","click_buy_now"
"방금 본 상픔 기준으로 잠깐 옵선별 가격 차이 있으면 같이 알려줘","95","read_option_info"
"일단 장바구니 목록으로 이동 좀","71","click_cart"
"일단다시히어비메인으로가자해주세요","68","go_hearbe"
"일단 반품 신청 진행해줘 부탁드립니다","93","request_exchange_return"
"이번엔 이 페이지에서 다음으로 뭐 할 수 있어 해봐","74","read_current_page_actions"
"계정 연결 끊어줘","73","click_logout"
"잠깐 총 주문 금액 보여줘 부탁해 먼저","87","read_order_amount"
"내일 운동 계획 기록해줘","0","unknown"
"상세페이지 핵심만 읽어줘 해줄래","77","read_product_info"
"일단실사용자후기알려줘부탁드립니다","81","read_reviews"
"결재 요청 보내줘 좀 해주이소","89","submit_payment"
"지금내주문리스트로이동좀","70","click_order_history"
"지금 화면에서 교환 반품 접수해주라 부탁드립니다","93","request_exchange_return"
"위시리스트 추가해줘 해줄래","82","click_wishlist"
"현재 페이지에서지금 첫 번째 항목 선택 취소해 해봐","85","unselect_cart_item"
"결제 실행해줘 가능해 부탁","89","submit_payment"
"급한데 결재수단이랑 배송상태 포함해서 읽어줘 부탁해","91","read_order_detail"
"지금화면에서계정연결끊어줘부탁드립니다","73","click_logout"
"방금 본 상품 기준으로 선택 안 된 상품 선택해줘 해주이소","84","select_cart_item"
"잠깐 주문내역 탭 눌러 먼저","70","click_order_history"
"이번엔주문내역페이지열어줘해주세요","70","click_order_history"
"히어비 첫 화면으로 보내줘","68","go_hearbe"
"오늘 일정 요약해줘","0","unknown"
"방금 본 상품 기준으로 주문 합계 금액 확인해줘","87","read_order_amount"
"급한데 수량 변경 적용해주세요","86","adjust_item_quantity"
"지금 선택 버튼 눌러줘 부탁드립니다","84","select_cart_item"
"이번 주문 기준으로 일단 결재 단계 마무리해줘 가능해","89","submit_payment"
"지금 지금 주문 정보 한 번 정리해줘 부탁드립니다","88","read_payment_order_info"
"급한데 최근 리뷰 요약해줘","81","read_reviews"
"일단 이거 장바구니로 보내 해줄래","79","click_add_to_cart"
"현재 페이지에서 교환 요청 페이지 열어줘 부탁","93","request_exchange_return"
"잠깐 카트 페이지로 이동해 부탁드립니다 해주이소","71","click_cart"
"먼저 최종 주문 확인 정보말해줘 가능해","88","read_payment_order_info"
"여기서 할 수 있는 명령 말해줘 가능해 먼저","74","read_current_page_actions"
"이번엔 최종 주문 확인 정보 말해줘 좀","88","read_payment_order_info"
"로긴 창 띄워줘 좀","72","click_login"
"현재 페이지에서 환불 반품 신청해줘 부탁드립니다","93","request_exchange_return"
"이번 주문 기준으로지금 실사용자 후기 알려줘","81","read_reviews"
"잠깐 담기 버튼 눌러줘 해줄래","79","click_add_to_cart"
"저녁날씨요약해줘","0","unknown"
"지금 화면에서 급한데 원래 히어비 화면으로 돌아가자","68","go_hearbe"
"가능한 버튼들 설명해주세요 부탁","74","read_current_page_actions"
"현재 페이지에서 먼저 담기 버튼 눌러줘 먼저","79","click_add_to_cart"
"이번엔 첫 번째 항목 선택 취소해","85","unselect_cart_item"
"잠깐 결제수단이랑 배송상태 포함해서 읽어줘 해봐","91","read_order_detail"
"급한데 자동로그인해제하고 로과웃해","73","click_logout"
"바로 카트 목록 하나씩 말해줘 먼저","83","read_cart_items"
"방금 본 상품 기준으로 여기서 히어비로 이동해줘","68","go_hearbe"
"지금 식단 알려줘","0","unknown"
"급한데로긴단계로넘어가","72","click_login"
"일단 장바구니 항목 전부 보여줘 부탁해","83","read_cart_items"
"급한데 장바구니에 담긴 상품 읽어줘 해줄래","83","read_cart_items"
"주문기록삭제버튼눌러줘해줘부탁","94","delete_order_history"
"먼저 화면 기준으로 가능한 명령 알려줘 먼저","74","read_current_page_actions"
"먼저 로그인 페이지로 보내줘 좀 지금","72","click_login"
"지금 화면에서 지금 키보드 상품 검샥해줘 해주이소","69","search_products"
"지금 화면에서 먼저 검색 목록에서 이거 눌러 해줘","76","select_search_result"
"지금 화면에서 이 상품 찜 목록에 넣어줘","82","click_wishlist"
"현재 페이지에서 옵션 빨간색으로 바꿔주세요 해봐","78","update_product_option"
"먼저 제품 소개 문구 읽어줘 부탁해 바로","77","read_product_info"
"방금 본상품 기준으로 먼저 장바구니 말고 바로 주문해","80","click_buy_now"
"이번 주문 기준으로 급한데 선택 가능한 옵선만 알려줘 해줘 해봐","95","read_option_info"
"현재페이지에서장바구니항목전부보여줘","83","read_cart_items"
"바로 상픔명 가격 로켓배송 여부 알려줘 부탁","77","read_product_info"
"잠깐 반품 사유 선택해서 신청해줘 해주세요","93","request_exchange_return"
"결과 리스트 간단히 말해줘","75","read_search_results"
"이번엔 내 계정에서 나가기 좀","73","click_logout"
"현재 페이지에서 일단 옵선 정보 읽어줘 해주이소","95","read_option_info"
"방금 본 상품 기준으로 옵션 리스트 위에서부터 읽어줘","95","read_option_info"
"먼저 상픔 상세 설명 알려줘 해줘 먼저","77","read_product_info"
"지금화면에서일단결재하기눌러줘","89","submit_payment"
"바로 하트 버튼 눌러주세요 해주세요 해봐","82","click_wishlist"
"잠깐 첫 번째 상픔 눌러줘","76","select_search_result"
"일단 어떤 상픔 몇 개 샀는지 알려줘 부탁","91","read_order_detail"
"지금 주문 확정하고 결제해줘","89","submit_payment"
"이번 주문 기준으로 지금 히어비로 되돌아가 해주세요","68","go_hearbe"
"급한데 장바구니 수량 오개로 변경해","86","adjust_item_quantity"
"일단 이 계정 종료해줘 해줘","73","click_logout"
"바로 쿠팡에서 나가고 히어비로 가","68","go_hearbe"
"이번엔 로긴 화면 열어줘 해줘","72","click_login"
"지금 화면에서 먼저 카트 상픔명과 수랑 읽어줘","83","read_cart_items"
"이번 주문 기준으로 일단 쿠팡에서 나가고 히어비로 가","68","go_hearbe"
"이번 주문 기준으로 장바구니 열어줘 가능해","71","click_cart"
"지금 화면에서 급한데 결제하기 눌러줘 부탁해","89","submit_payment"
"더 이상 안 보이게 삭제해줘 가능해","94","delete_order_history"
"잠깐 배송 상태 확인해줘 부탁해 부탁","92","click_track_delivery"
"이번 주문 기준으로 바로 유산균 상픔 검샥해줘","69","search_products"
"지금 지금 바로 결제 화면 가자 해주세요","80","click_buy_now"
"이 상품 즉시 주문할래","80","click_buy_now"
"바로 어떤 상품 몇 개 샀는지 알려줘","91","read_order_detail"
"이번 주문 기준으로 리뷰에서 단점 위주로 알려줘 좀","81","read_reviews"
"이번 주문 기준으로 일단 이 주문의 금액 배송정보 읽어줘","91","read_order_detail"
"급한데 교환 반품 접수해줘","93","request_exchange_return"
"현재 페이지에서 이번엔 히어비 홈페이지 열어줘 해줘 바로","68","go_hearbe"
"잠깐 색상 사이즈 옵션 읽어줘 해주세요","95","read_option_info"
"급한데 옵선 말고 기본 정보 먼저 읽어줘","77","read_product_info"
"지금 내 주문 배송 조희 들어가 해봐","92","click_track_delivery"
"잠깐 이 계정 종료해줘 해줘 해봐","73","click_logout"
"이 페이지 가능한 작업 목록 보여줘","74","read_current_page_actions"
"일단 수량 하나 늘려줘","86","adjust_item_quantity"
"현재 페이지에서 급한데 현재 장바구니 상태 알려줘","83","read_cart_items"
"방금 본 상품 기준으로 일단 화면 기준으로 가능한 명령 알려줘 가능해 바로","74","read_current_page_actions"
"히어비 홈으로 바로 이동 지금","68","go_hearbe"
"이번 주문 기준으로 일단 이거 장바구니로 보내 해봐","79","click_add_to_cart"
"로그인시작해줘 부탁해","72","click_login"
"방금 본 상픔 기준으로 일단 옵선에서 블랙 선택해줘 부탁해","78","update_product_option"
"이번 주문 기준으로 잠깐 무선 이어폰 검색해 해주세요","69","search_products"
"이번주알람알려줘","0","unknown"
"방금 본 상픔 기준으로 일단 카트로 바로 가 해줄래 지금","71","click_cart"
"카트 항목선택해","84","select_cart_item"
"키보드 상품 검색해줘","69","search_products"
"이번엔 이 주문 건 자세히 알려줘 해줄래","91","read_order_detail"
"바로 리뷰 읽어줘 부탁드립니다","81","read_reviews"
"일단 이 상픔 수량 이개로 바꿔줘 해주이소","86","adjust_item_quantity"
"바로 내 주문 리스트로 이동","70","click_order_history"
"키보드 상픔 검샥해줘","69","search_products"
"먼저 이 상품 옵선 항목 설명해줘 부탁해","95","read_option_info"
"이번 주문 기준으로 바로 주문번호 기준으로 상세 보여줘 가능해","91","read_order_detail"
"급한데 이 물건 정보 한 번 훑어줘 부탁드립니다","77","read_product_info"
"옵션 선택 전에 정보 먼저 읽어줘","95","read_option_info"
"바로 장바구니 리스트 요약해줘 해주세요","83","read_cart_items"
"검색된 제품 이름만 읽어줘 해주세요","75","read_search_results"
"내일 날씨 확인해줘","0","unknown"
"급한데 한 번에 구매하기 눌러 해주이소","80","click_buy_now"
"지금 화면에서 급한데 내 주문 배송조회 들어가 바로","92","click_track_delivery"
"이번엔 먼저 로긴부터 할게 먼저","72","click_login"
"먼저 구매자 평가 읽어줘 해주이소","81","read_reviews"
"현재페이지에서바로어떤상픔몇개샀는지알려주라해줄래부탁","91","read_order_detail"
"방금 본 상픔 기준으로 먼저 화면 기준으로 가능한 명령 알려줘","74","read_current_page_actions"
"지금 선택만 해제해줘 부탁해","85","unselect_cart_item"
"이번 주문 기준으로 구매 전에 장바구니에 넣어줘 좀 먼저","79","click_add_to_cart"
"급한데 배송 조회 눌러줘","92","click_track_delivery"
"이번 주문 기준으로 잠깐 하트 버튼 눌러주세요 해줘","82","click_wishlist"
"지금 화면에서 잠깐 쿠팡에서 비타민 찾아봐 가능해","69","search_products"
"잠깐 가격 제일 낮은 결과 선택해줘","76","select_search_result"
"지금 화면에서 급한데 상세 주문 정보 확인해줘","91","read_order_detail"
"이번엔 상품 선택 취소해줘 지금","85","unselect_cart_item"
"잠깐 담긴 물건들 가격 같이 알려줘 좀 해주이소","83","read_cart_items"
"이번 주문 기준으로 옵선 정보 읽어줘","95","read_option_info"
"지금 선택만 해제해줘","85","unselect_cart_item"
"옵션 정보 화면 내용 알려줘 부탁","95","read_option_info"
"이번 주문 기준으로 먼저 배송조회 눌러줘 해주세요 해봐","92","click_track_delivery"
"잠깐 결제할 총액 읽어줘 부탁","87","read_order_amount"
"이번주문기준으로먼저최근주문내역보게이동해줘좀","70","click_order_history"
"이번 주문 기준으로 먼저 장바꾸니 페이지 열기 해줄래","71","click_cart"
"지금 결제 화면 항목들 설명해줘 해줄래 부탁","88","read_payment_order_info"
"이번엔 제품 교환 접수해줘 먼저","93","request_exchange_return"
"방금 본 상품 기준으로 쿠팡 로그인하러 가","72","click_login"
"현재 페이지에서 먼저 이 물건 주문 대상으로 선택해 부탁해","84","select_cart_item"
"바로 옵선 빨간색으로 바꿔줘 가능해 해주이소","78","update_product_option"
"지금 화면에서 먼저 로긴 버튼 눌러줘 해줘","72","click_login"
"지금 화면에서 일단 담아둔 상픔 보러 가","71","click_cart"
"일단 이물건 주문 대상으로 선택해 해줘 먼저","84","select_cart_item"
"급한데 내가 내야 할 돈 얼마인지 말해주이소","87","read_order_amount"
"잠깐히어비 홈으로 바로 이동","68","go_hearbe"
"내가 시킨 것들 보이는 페이지로 가 해주세요","70","click_order_history"
"잠깐 옵션 이개로 조정해줘 좀 부탁","78","update_product_option"
"잠깐 상품 개수 마이너스 일 해줘","86","adjust_item_quantity"
"급한데 옵션 정보 화면 내용 알려줘 좀","95","read_option_info"
"이번 주 날씨 요약해줘","0","unknown"
"계정 로그인 진행해 부탁해 지금","72","click_login"
"바로선택안된상품선택해줘해봐","84","select_cart_item"
"지금 화면에서 먼저 쇼핑 끝났으니 히어비로 복귀해","68","go_hearbe"
"지금 장바꾸니 내용 확인해주이소 해봐","83","read_cart_items"
"같은 상품 장바구니에 추가해 가능해","79","click_add_to_cart"
"잠깐 내 계정에서 나가기 부탁드립니다","73","click_logout"
"한줄 후기들 먼저 보여줘 좀","81","read_reviews"
"바로 주문서 내용 읽어줘","88","read_payment_order_info"
"지금 화면에서 가능한 버튼들 설명해주세요 해줄래 먼저","74","read_current_page_actions"
"급한데 결제 요청 보내줘 좀 해봐","89","submit_payment"
