"text","label_id","label"
"방금 본 상픔 기준으로 지금 쿠폰 적용 후금액 알려줘 바로","87","read_order_amount"
"현재 페이지에서 잠깐 내역에서 이 건 삭제해줘 해주세요","94","delete_order_history"
"현재 페이지에서 히어비 메인 페이지로 전환해줘","68","go_hearbe"
"현재 페이지에서 일단 구매자 평가 읽어줘 해줄래","81","read_reviews"
"현재 페이지에서 이번엔 카트 항목 선택해 부탁해","84","select_cart_item"
"지금 화면에서 일단 내 주문 배송조회 들어가 해줄래","92","click_track_delivery"
"일단 상품명 가격 로켓배송 여부 알려줘","77","read_product_info"
"현재 페이지에서 바로 선택된 상품들 읽어줘 좀 먼저","83","read_cart_items"
"방금 담은 거 수량 이로 맞춰줘 바로","86","adjust_item_quantity"
"지금 주문기록 보러 가자","70","click_order_history"
"방금본상품기준으로잠깐결제단계마무리해줘해주세요지금","89","submit_payment"
"방금 본 상품 기준으로 로그아웃 버튼 눌러줘 가능해","73","click_logout"
"방금 본 상픔 기준으로 이 상품 카트에 넣어줘 해줘 부탁","79","click_add_to_cart"
"바로 검색된 제품 이름만 읽어줘 좀","75","read_search_results"
"로그인상태해제해해주세요","73","click_logout"
"지금 화면에서 먼저 교환 반품 접수해줘 지금","93","request_exchange_return"
"잠깐 결재 직전 정보 읽어줘 부탁해 해봐","88","read_payment_order_info"
"쿠팡 말고 히어비 홈으로 돌아가 부탁해 해주이소","68","go_hearbe"
"이번 주문 기준으로 체크박스 꺼줘 해주세요지금","85","unselect_cart_item"
"방금본상품기준으로로긴버튼눌러줘","72","click_login"
"현재 페이지에서 지금 쿠팡에서 나가고 히어비로 가","68","go_hearbe"
"이번엔 구매하기 눌러줘해줘","80","click_buy_now"
"교환 처리 시작해줘 먼저","93","request_exchange_return"
"이 페이지에서 다음으로 뭐 할 수 있어 좀","74","read_current_page_actions"
"방금본상품기준으로지금품절아닌옵션만읽어줘부탁해","95","read_option_info"
"현재 페이지에서 수량 변경 적용해줘 부탁해","86","adjust_item_quantity"
"일단 내가 담은 거 보자 가능해","71","click_cart"
"이번 주 공부 계획 확인해줘","0","unknown"
"방금 본 상품 기준으로 최종 주문 확인 정보 말해줘","88","read_payment_order_info"
"이번 주문 기준으로 지금 결제 요청 보내줘 지금","89","submit_payment"
"지금 위시리스트에 추가해 바로","82","click_wishlist"
"잠깐 자동로그인 해제하고로가웃해 바로","73","click_logout"
"결재 전 주문 내역 확인해줘 바로","88","read_payment_order_info"
"먼저가격이랑배송정보같이읽어줘좀","77","read_product_info"
"먼저 이 제품 어떤 건지 설명해줘 해주세요 지금","77","read_product_info"
"방금 본 상픔 기준으로 지금 이 화면 기능 읽어줘","74","read_current_page_actions"
"이번 주문 기준으로 바로 세 번째 아이템 클릭해줘 해봐","76","select_search_result"
"이번 주문 기준으로 일단 상세페이지 핵심만 읽어줘 좀","77","read_product_info"
"이번 주문 기준으로 먼저 로그아웃 버튼 눌러줘 해주세요","73","click_logout"
"잠깐 색상 사이즈 옵선 읽어줘 바로","95","read_option_info"
"급한데교환처리시작해줘가능해","93","request_exchange_return"
"이번 주문 기준으로 히어비 홈으로 바로 이동","68","go_hearbe"
"방금 본 상품 기준으로 카트로 바로 가","71","click_cart"
"지금 화면에서 급한데 지금 결제로 넘어가 부탁해","80","click_buy_now"
"현재 페이지에서 먼저 결과 페이지 내용 읽어줘","75","read_search_results"
"이번 주문 기준으로 다시 히어비 메인으로 가자 부탁","68","go_hearbe"
"지금 화면에서 이번엔 일단 장바구니 추가해 부탁해","79","click_add_to_cart"
"아침 일정 계산해줘","0","unknown"
"지금 화면에서 바로 배송정보 추적해주세요 해줘","92","click_track_delivery"
"현재 페이지에서 바로 결제 완료까지 진행해줘 해주세요","89","submit_payment"
"현재 페이지에서 먼저 주문 상세 내역 설명해줘","91","read_order_detail"
"이 항목 주문 수량 조정해줘 좀","86","adjust_item_quantity"
"바로 이 상품 옵선 항목 설명해줘","95","read_option_info"
"방금 본 상품 기준으로 일단 계정 로그인 진행해 지금","72","click_login"
"이번엔 상품명 가격 로켓배송 여부 알려줘","77","read_product_info"
"방금 본 상품 기준으로 지금 히어비 메인 페이지로 전환해줘","68","go_hearbe"
"먼저로그인 단계로 넘어가 해봐","72","click_login"
"먼저 일인용 전기포트 검색해 좀","69","search_products"
"이번엔 주문 상세 내역 설명해줘 부탁드립니다","91","read_order_detail"
"먼저 옵선 정보 화면 내용 알려줘","95","read_option_info"
"이번주문기준으로이거말고다른색상있는지검색해줘부탁해","69","search_products"
"내 계정에서 나가기","73","click_logout"
"잠깐 상픔 요약해줘","77","read_product_info"
"방금 본 상품 기준으로 바로 생수 검색해주이소 부탁해","69","search_products"
"급한데 지금 바로 결재할게 해줘","89","submit_payment"
"지금 화면에서 바로 지금 담아둔 상픔 뭐 있어","83","read_cart_items"
"지금 화면에서 로긴 창 띄워줘","72","click_login"
"지금 로그인 단계로 넘어가","72","click_login"
"이 주문 기록 지워줘","94","delete_order_history"
"잠깐 쿠팡 로그인하러 가 해줘","72","click_login"
"일단 로긴 시작해줘","72","click_login"
"배송 상태확인해줘 해주세요","92","click_track_delivery"
"방금 본 상품 기준으로 장바구니 말고 바로 주문해","80","click_buy_now"
"이번주문기준으로장바구니페이지열기먼저","71","click_cart"
"이번 주문 기준으로 로긴 상태 해제해","73","click_logout"
"방금본상품기준으로닭가슴살찾아줘해주세요","69","search_products"
"이번엔 이 상픔 카트에 넣어줘","79","click_add_to_cart"
"장바구니 페이지 열기 지금","71","click_cart"
"이번엔 이거 바로 살게 해줘","80","click_buy_now"
"이번엔 선택 안 된 상픔 선택해줘 해주세요","84","select_cart_item"
"바로 성분 재질 정보 있으면 읽어줘 해주세요","77","read_product_info"
"바로 방금 검색한 목록에서 맨 위 상품 들어가","76","select_search_result"
"현재 페이지에서 이대로 결제 확정해주라 해줘","89","submit_payment"
"이 계정 종료해줘","73","click_logout"
"아침 식단 정리해줘","0","unknown"
"이번엔 반품 사유 선택해서 신청해줘","93","request_exchange_return"
"이번엔 성분 재질 정보 있으면 읽어줘 부탁드립니다","77","read_product_info"
"계정 로그인 진행해 부탁해","72","click_login"
"바로 결과 상픔들 순서대로 말해줘 해줘","75","read_search_results"
"현재 페이지에서 먼저 주문내역 페이지 열어줘 해줘","70","click_order_history"
"급한데 주문조회 페이지 들어가","70","click_order_history"
"사이즈를 이 칠 영으로 바꿔줘 해줄래","78","update_product_option"
"일단 일단 장바꾸니 추가해 해줄래 먼저","79","click_add_to_cart"
"급한데 리뷰 읽어줘","81","read_reviews"
"이번 주문 기준으로 급한데 바로 주문 버튼 눌러줘 해줄래","80","click_buy_now"
"이번 주문 기준으로 지금 옵선 정보 화면 내용 알려줘 부탁해","95","read_option_info"
"잠깐 리뷰 탭 내용 읽어줘","81","read_reviews"
"방금 본 상픔 기준으로 일단 최종 주문확인 정보 말해줘","88","read_payment_order_info"
"이번엔 생수 검샥해줘 좀 바로","69","search_products"
"아침 알람 기록해줘","0","unknown"
"다음 주 알람 알려줘","0","unknown"
"지금선택된 상픔들 읽어줘","83","read_cart_items"
"잠깐 지금 결제로 넘어가 해주세요 해주이소","80","click_buy_now"
"방금 본 상픔 기준으로 바로 결재 완료 처리해주세요","89","submit_payment"
"급한데 지금 선택한 옵션 취소하고 새로 선택해줘 해줄래","78","update_product_option"
"먼저 고양이 사료 검색해봐 부탁","69","search_products"
"일단결과페이지내용읽어줘해줄래","75","read_search_results"
"현재 페이지에서 어떤 상품 결제하는지 읽어줘 해줘","88","read_payment_order_info"
"급한데결재 직전 정보 읽어줘 해주세요","88","read_payment_order_info"
"이번엔 교환 요청 페이지 열어줘 해주세요","93","request_exchange_return"
"지금 화면에서 일단 히어비 홈 탭으로 넘어가 해주이소","68","go_hearbe"
"지금 화면에서 이번엔 주문 확정하고 결제해줘 해주세요","89","submit_payment"
"담기 버튼 눌러줘","79","click_add_to_cart"
"방금 본 상품 기준으로 지금 지금 담아둔 상품 뭐 있어 해줄래","83","read_cart_items"
"현재 페이지에서 잠깐 이거 바로 살게 해줄래","80","click_buy_now"
"지금 운송장 흐름 확인해줘 해주세요 해주이소","92","click_track_delivery"
"먼저 구매단계로 이동해줘 부탁해","80","click_buy_now"
"현재 페이지에서 잠깐 검색 결과 읽어줘 해주세요 바로","75","read_search_results"
"이번 주문 기준으로 일단 담긴 물건 확인하자 해주세요","71","click_cart"
"이번 주문 기준으로 지금 결재 실행해줘 부탁드립니다","89","submit_payment"
"주문내역정리하려고이거삭제해해줄래해주이소","94","delete_order_history"
"이번주수면기록기록해줘","0","unknown"
"바로 쿠팡 계정 로긴해줘 해줘","72","click_login"
"현재 페이지에서 지금 결제 화면 항목들 설명해줘 부탁드립니다","88","read_payment_order_info"
"일단 주문 정보 읽어주세요 부탁드립니다","88","read_payment_order_info"
"이번 주문 기준으로 지금 이 제품 담기 클릭해줘 해줄래","79","click_add_to_cart"
"지금 검색 결과 몇개인지랑 같이 읽어줘 좀 해봐","75","read_search_results"
"이번 주문 기준으로 최근 주문내옉 보게 이동해줘","70","click_order_history"
"현재 페이지에서 이번엔 일단 장바구니 추가해 해줄래","79","click_add_to_cart"
"방금 본 상품 기준으로 일단 지금 선택한 옵션 취소하고 새로 선택해줘 해주세요","78","update_product_option"
"이번 주문 기준으로 구매하기 눌러줘 해줄래","80","click_buy_now"
"최근 리뷰 요약해줘 해줄래 해주이소","81","read_reviews"
"이번엔 총 결제금액 얼마야 해주세요","87","read_order_amount"
"방금 본 상품 기준으로 이 상품 옵션 종류 뭐 있어 부탁드립니다","95","read_option_info"
"먼저 전체 선택 해제해줘 해주세요","85","unselect_cart_item"
"지금 검색 결과를 하나씩 불러줘","75","read_search_results"
"이번엔 내 주문 배송 조회 들어가 먼저","92","click_track_delivery"
"지금 화면에서 지금 색상 네이비로 변경해줘 해줄래","78","update_product_option"
"먼저 지금 뜬 검색 목록 설명해줘","75","read_search_results"
"잠깐 담기 버튼 눌러줘해줘","79","click_add_to_cart"
"지금 화면에서 지금 검색 결과 몇 개인지랑 같이 읽어줘 좀","75","read_search_results"
"이번엔 해당 주문 기록제거해줘","94","delete_order_history"
"잠깐이거장바꾸니로보내해줄래부탁","79","click_add_to_cart"
"최종 결제 금액 읽어줘","87","read_order_amount"
"먼저 구매 단계로 이동해줘","80","click_buy_now"
"지금 환불 반품 신청해줘","93","request_exchange_return"
"현재페이지에서히어비홈으로바로이동좀","68","go_hearbe"
"지금 화면에서 장바구니 열어줘 해주세요 해주이소","71","click_cart"
"급한데 지금 뜬 검샥 목록 설명해주세요","75","read_search_results"
"구매하기 눌러줘","80","click_buy_now"
"현재 페이지에서 이번엔 지금 바로 결제할게 부탁드립니다 부탁","89","submit_payment"
"일단 주문 합계 금액 확인해줘 부탁해","87","read_order_amount"
"여기서 할 수 있는 명령 말해줘","74","read_current_page_actions"
"먼저 전체 선택 해제해줘 해줘 먼저","85","unselect_cart_item"
"이번 주문 기준으로 지금 배송정보 추적해줘 지금","92","click_track_delivery"
"방금 본 상픔 기준으로 로그인 화면 열어줘 해줄래 지금","72","click_login"
"급한데 어떤 상품 몇 개 샀는지 알려줘","91","read_order_detail"
"급한데 검색 결과에서 두 번째 거 선택해줘 해주이소","76","select_search_result"
"지금 화면에서 급한데 로그인 화면 열어줘","72","click_login"
"이번엔 계정 로그인 진행해 해줘","72","click_login"
"지금 화면에서 상픔 선택 취소해줘 해줘","85","unselect_cart_item"
"결과 화면 요약해줘 부탁해","75","read_search_results"
"방금 본 상픔 기준으로 이번엔 이거 찜 목록에 담아 좀 지금","82","click_wishlist"
"일단 로그아웃 버튼 눌러줘 부탁","73","click_logout"
"현재 페이지에서 지금 장바구니 열어줘 해줄래","71","click_cart"
"지금 화면에서 급한데 위시리스트 추가해줘 해주세요","82","click_wishlist"
"이번 주문 기준으로 지금 선택 가능한 옵션만 알려주라 부탁드립니다 해주이소","95","read_option_info"
"지금 화면에서 일단 쿠팡 로그인하러 가 해줄래 해봐","72","click_login"
"방금 본 상품 기준으로 급한데 지금 위치에서 할 수 있는 일 정리해줘 해주세요","74","read_current_page_actions"
"지금 화면에서 급한데 이 상품 옵션 항목 설명해줘","95","read_option_info"
"현재 페이지에서 옵션 로 변경해줘 부탁드립니다","78","update_product_option"
"지금 화면에서 찜하기 눌러줘","82","click_wishlist"
"지금 아기 물티슈 찾아줘 해줘","69","search_products"
"현재페이지에서반품사유선택해서신청해줘해주세요","93","request_exchange_return"
"주말운동계획기록해줘","0","unknown"
"이번엔 선풍기 검색 결과 보여줘 해줘","69","search_products"
"이번 주문 기준으로 키보드 상픔 검색해줘 지금","69","search_products"
"방금 본 상품 기준으로 급한데 이 제품 담기 클릭해줘","79","click_add_to_cart"
"급한데방금검샥한목록에서맨위상픔들어가","76","select_search_result"
"아침 수면 기록 확인해줘","0","unknown"
"급한데 화면 기준으로 가능한 명령 알려줘 좀","74","read_current_page_actions"
"먼저 검샥 목록에서 이거 눌러 해줄래","76","select_search_result"
"이번 주문 기준으로 이번엔 결과 화면 요약해줘","75","read_search_results"
"현재 페이지에서 일단 장바꾸니 리스트 요약해줘","83","read_cart_items"
"바로 지금 고를 수 있는옵션 정리해줘","95","read_option_info"
"바로히어비홈으로바로이동가능해해봐","68","go_hearbe"
"지금 화면에서 급한데 총 주문 금액 보여줘","87","read_order_amount"
"이번엔 가격 제일 낮은 결과 선택해주이소 해줘 해봐","76","select_search_result"
"잠깐 선택 해제 버튼 눌러줘 부탁","85","unselect_cart_item"
"검색된 제품 이름만 읽어줘","75","read_search_results"
"전체 선택 해제해줘 바로","85","unselect_cart_item"
"이번 주문 기준으로 이 주문 건 교환해줘 부탁","93","request_exchange_return"
"현재 페이지에서 급한데 총 주문 금액 보여줘 해봐","87","read_order_amount"
"현재 페이지에서 계정 연결 끊어줘 부탁드립니다 해주이소","73","click_logout"
"잠깐 이 계정 종료해줘 부탁해","73","click_logout"
"이번엔 이 상품 즉시 주문할래 가능해 부탁","80","click_buy_now"
"먼저 자동로그인 해제하고 로그아웃해 해줘 바로","73","click_logout"
"잠깐 수랑 변경 적용해줘 부탁해","86","adjust_item_quantity"
"현재 페이지에서 주문 상세 요약해줘 지금","91","read_order_detail"
"현재 페이지에서 급한데 상품금액 플러스 배송비 합계 알려줘 해줄래 바로","87","read_order_amount"
"체크된거풀어줘부탁드립니다","85","unselect_cart_item"
"한줄 후기들 먼저 보여줘","81","read_reviews"
"현재 페이지에서 이번엔 구매 단계로 이동해줘 해줄래 바로","80","click_buy_now"
"현재 페이지에서 지금 위치에서 할 수 있는 일 정리해줘","74","read_current_page_actions"
"현재페이지에서일단리부많은상픔으로들어가줘","76","select_search_result"
"이번주문기준으로급한데어떤상품결제하는지읽어줘해봐","88","read_payment_order_info"
"이번 주문 기준으로 지금 지금 보는 상픔 담아줘 해봐","79","click_add_to_cart"
"지금 나중에 보게 찜해둬","82","click_wishlist"
"일단 체크박스 눌러서 선택해줘","84","select_cart_item"
"저녁 알람 체크해줘","0","unknown"
"잠깐 개수 삼으로 조절해줘","86","adjust_item_quantity"
"이번주문기준으로급한데방금담은거수량이로맞춰줘가능해","86","adjust_item_quantity"
"이번 주문 기준으로 잠깐 무선 이어폰 검색해 해줄래 해봐","69","search_products"
"지금화면에서 먼저 장바구니 탭 눌러주세요 해주세요 지금","71","click_cart"
"이번 주문 기준으로 잠깐 아기 물티슈 찾아줘 가능해 해봐","69","search_products"
"현재 페이지에서 급한데 리부 읽어줘","81","read_reviews"
"이번 주문 기준으로 이번엔 카트 상품명과 수량 읽어줘해봐","83","read_cart_items"
"현재 페이지에서이번엔 히어비 홈 탭으로 넘어가","68","go_hearbe"
"이번 주문 기준으로 급한데 지금 검색 결과 몇 개인지랑 같이 읽어줘 가능해","75","read_search_results"
"이거 말고 다른 색상 있는지 검색해줘 부탁드립니다","69","search_products"
"이번 주문 기준으로 일단 장바구니 리스트 요약해주라 해줘","83","read_cart_items"
"최근 리부요약해줘 좀","81","read_reviews"
"지금 이 주문 내역 지우기 해줘해줄래 지금","94","delete_order_history"
"결과 페이지 내용 읽어줘 좀","75","read_search_results"
"이번엔상품선택취소해줘해줄래부탁","85","unselect_cart_item"
"선택안 된 상픔 선택해줘 해줘","84","select_cart_item"
"방금 본 상픔 기준으로 급한데 쿠팡에서 비타민 찾아봐 해주이소","69","search_products"
"지금 화면에서 해당주문 기록 제거해줘 부탁","94","delete_order_history"
"지금 구매하기 눌러줘 해줘","80","click_buy_now"
"급한데 지금 페이지안내해줘 부탁해","74","read_current_page_actions"
"지금 화면에서 이번엔 배송 단계 확인해줘 해봐","92","click_track_delivery"
"계정 로그인 진행해 지금","72","click_login"
"현재 페이지에서 바로 구매 단계로 이동해줘 해줘 먼저","80","click_buy_now"
"현재 페이지에서 이번엔 지금 결제 예정 금액 말해줘 지금","87","read_order_amount"
"지금 배송비 포함 금액 읽어줘 해줘","87","read_order_amount"
"사진 리뷰 있는지 읽어줘 가능해","81","read_reviews"
"지금상품개수플러스 일해줘","86","adjust_item_quantity"
"현재 페이지에서 지금 주문내역 탭 눌러 부탁해 해주이소","70","click_order_history"
"일단 로그인 시작해줘 가능해 먼저","72","click_login"
"현재 페이지에서 지금 지금 배송 위치 보여줘 부탁해","92","click_track_delivery"
"쿠폰 적용 후 금액 알려줘 먼저","87","read_order_amount"
"급한데 여기서 할 수 있는 명령 말해줘 부탁","74","read_current_page_actions"
"이 상픔 정보 읽어줘 좀","77","read_product_info"
"옵션 정보 읽어줘부탁드립니다 부탁","95","read_option_info"
"이번엔 담긴 물건들 가격 같이 알려줘 해주세요","83","read_cart_items"
"잠깐 내 계정으로 로그인할래 먼저","72","click_login"
"방금 본 상품 기준으로 카트 아이콘 눌러줘","71","click_cart"
"지금 화면에서 장바구니 목록으로 이동","71","click_cart"
"이번 주문 기준으로 잠깐 지금 페이지 안내해줘 해줄래 해주이소","74","read_current_page_actions"
"방금 본 상품기준으로 이번엔 상품 선택 취소해줘 가능해","85","unselect_cart_item"
"가능한 버튼들 설명해주라 부탁드립니다","74","read_current_page_actions"
"일단바로구매해부탁","80","click_buy_now"
"쿠팡계정로긴해주세요","72","click_login"
"내 장바구니 내역 읽어줘 부탁드립니다","83","read_cart_items"
"먼저 찜하기 눌러줘 좀","82","click_wishlist"
"옵션 빨간색으로 바꿔줘 해주세요","78","update_product_option"
"지금 화면에서 이번엔 옵션 선택 전에 정보 먼저 읽어줘 해줘","95","read_option_info"
"지금 화면에서 바로 이거 찜 목록에 담아","82","click_wishlist"
"현재페이지에서찜하기눌러줘해주세요지금","82","click_wishlist"
"현재 페이지에서 위시리스트에 추가해 좀","82","click_wishlist"
"바로 리뷰에서 단점 위주로 알려줘 먼저","81","read_reviews"
"이번주문기준으로잠깐결제직전정보읽어줘가능해","88","read_payment_order_info"
"급한데 옵션을 세트 구성으로 바꿔줘 해줄래","78","update_product_option"
"이번엔 결제 페이지 주문 내용 알려줘 지금","88","read_payment_order_info"
"사진 리부 있는지 읽어줘 해줄래","81","read_reviews"
"현재 페이지에서 바로 최근 주문내역 보게 이동해줘 가능해","70","click_order_history"
"체크된거 풀어줘 부탁드립니다","85","unselect_cart_item"
"이번 주문 기준으로 지금 결재 단계 마무리해줘 해줘 바로","89","submit_payment"
"지금 화면에서 상세페이지 핵심만 읽어줘","77","read_product_info"
"이물건 주문 대상으로 선택해 가능해","84","select_cart_item"
"이번 주문 기준으로 먼저 이 페이지 가능한 작업 목록 보여줘 해줘 바로","74","read_current_page_actions"
"지금 화면에서 먼저 옵션에서 대용량으로 바꿔줘 해줄래 부탁","78","update_product_option"
"색상 사이즈 옵션 읽어줘 해주이소","95","read_option_info"
"주문 상세 페이지 내용 읽어줘","91","read_order_detail"
"주문 배송 조회 메뉴 눌러줘","70","click_order_history"
"이번 주문 기준으로 바로 위시리스트 추가해줘 해줘","82","click_wishlist"
"지금 화면에서 이번엔 배송정보 추적해줘 좀","92","click_track_delivery"
"바로 내 계정에서 나가기 해줘","73","click_logout"
"이번엔 어떤 상픔 몇 개 샀는지 알려줘 부탁해 해주이소","91","read_order_detail"
"지금 화면에서 지금 옵션 정보 읽어주라 해봐","95","read_option_info"
"카트 상품명과 수량 읽어줘","83","read_cart_items"
"일단 네 번째 결과 선택해","76","select_search_result"
"방금 본 상품 기준으로 급한데 구매하기 눌러줘 부탁해 부탁","80","click_buy_now"
"방금 본 상품 기준으로 이번엔 내계정으로 로그인할래","72","click_login"
"현재페이지에서계정연결끊어줘해봐","73","click_logout"
"지금 화면에서 지금 장바꾸니 화면 보여줘해주세요","71","click_cart"
"현재페이지에서급한데장바꾸니목록으로이동해줄래","71","click_cart"
"먼저로그아웃 버튼 눌러줘 지금","73","click_logout"
"먼저 이 상픔 수랑이개로 바꿔줘","86","adjust_item_quantity"
"결과 리스트 간단히 말해줘 부탁드립니다","75","read_search_results"
"방금 본 상품 기준으로 로그인 상태 해제해 지금","73","click_logout"
"배송 현황 확인 버튼 눌러주세요 좀","92","click_track_delivery"
"현재 페이지에서 환불 반품 신청해줘 먼저","93","request_exchange_return"
"방금 본 상픔 기준으로 상품 개수 마이너스 일 해주세요 바로","86","adjust_item_quantity"
"지금 화면에서 잠깐 결제 페이지 주문 내용 알려줘 부탁해 해봐","88","read_payment_order_info"
"먼저 만족도 높은 리뷰 먼저 읽어줘 해줘 해주이소","81","read_reviews"
"방금 본 상픔 기준으로 지금 개수 삼으로 조절해줘 부탁드립니다 해주이소","86","adjust_item_quantity"
"방금 본 상픔 기준으로 급한데 쿠팡에서 로과웃 진행해 부탁드립니다","73","click_logout"
"이번 주문 기준으로 사이즈를 이 칠 영으로 바꿔줘 가능해","78","update_product_option"
"방금 본 상픔 기준으로 일단 이거 바로 살게 좀","80","click_buy_now"
"현재 페이지에서 이번엔 이 화면 기능 읽어줘","74","read_current_page_actions"
"방금 본 상픔 기준으로 잠깐 색상 사이즈 옵선 읽어줘 해주세요","95","read_option_info"
"방금 본 상픔 기준으로 이번엔 방금 검샥한 목록에서 맨 위 상품 들어가 해줘","76","select_search_result"
"주문 상세 내역 설명해줘 먼저","91","read_order_detail"
"상위 검색 결과 알려줘 먼저","75","read_search_results"
"지금 화면에서 급한데 쿠팡에서 로가웃 진행해","73","click_logout"
