"text","label_id","label"
"바로 주문 기록 삭제 버튼 눌러줘","94","delete_order_history"
"지금 화면에서 일단 옵션 정보 화면 내용 알려줘 좀","95","read_option_info"
"현재 페이지에서 바로 최근 주문내역 보게 이동해줘 해주세요","70","click_order_history"
"바로 결제 완료까지 진행해줘 해주세요 먼저","89","submit_payment"
"현재 페이지에서 지금 이 제품 담기 클릭해줘 가능해 해주이소","79","click_add_to_cart"
"현재 페이지에서 바로 한번에 구매하기 눌러 해줄래","80","click_buy_now"
"잠깐수량하나늘려줘","86","adjust_item_quantity"
"이번엔 배송 상태 확인해줘 해줄래","92","click_track_delivery"
"지금화면에서잠깐주문내역에서숨겨줘","94","delete_order_history"
"이번 주문 기준으로 바로 카트 항목 선택해 해줄래 바로","84","select_cart_item"
"바로 다시 히어비 메인으로 가자 좀","68","go_hearbe"
"이번 주문 기준으로 먼저 제품 소개 문구 읽어주라 해줄래","77","read_product_info"
"결제 버튼 실행해 해줘","89","submit_payment"
"이번엔두 번째 상품만 선택해줘 해줘","84","select_cart_item"
"방금 본 상픔 기준으로 리뷰 탭 내용 읽어줘 부탁드립니다","81","read_reviews"
"카트 항목 선택해 좀","84","select_cart_item"
"이번엔 택배 조회 화면 열어줘 부탁해","92","click_track_delivery"
"내 주문 배송 조회 들어가 해줘","92","click_track_delivery"
"히어비 홈으로 바로 이동","68","go_hearbe"
"이번 주문 기준으로 이 페이지 가능한 작업 목록 보여줘 가능해","74","read_current_page_actions"
"지금 화면에서 잠깐 주문서 내용읽어줘","88","read_payment_order_info"
"현재 페이지에서받는 사람 주소 상품 정보 읽어줘 부탁드립니다","88","read_payment_order_info"
"배송비포함금액읽어줘좀부탁","87","read_order_amount"
"담아둔 상픔 보러 가","71","click_cart"
"나중에 살 거로 표시해줘","82","click_wishlist"
"지금 화면에서 지금 보는 상품 담아줘","79","click_add_to_cart"
"방금 본 상품 기준으로 한 번 담아둘게 장바구니 추가","79","click_add_to_cart"
"방금 본 상품 기준으로 바로 주문내역 삭제해줘","94","delete_order_history"
"방금 본상픔 기준으로 급한데 이대로 결재 확정해줘 부탁드립니다 해봐","89","submit_payment"
"현재 페이지에서 배송 진행상황 눌러줘 해주세요","92","click_track_delivery"
"현재 페이지에서 먼저 주문 합계 금액 확인해줘 먼저","87","read_order_amount"
"이대로 결제 확정해줘","89","submit_payment"
"결제할 총액 읽어줘","87","read_order_amount"
"이번 주문 기준으로 급한데 상품 상세 설명알려줘 좀","77","read_product_info"
"현재 페이지에서 지금 결과 화면 요약해줘 먼저","75","read_search_results"
"이번 주문 기준으로 급한데 구매 전에 장바구니에 넣어줘","79","click_add_to_cart"
"먼저 장바꾸니에 담긴 상픔 읽어줘 부탁드립니다","83","read_cart_items"
"주문 요약 정보 말해줘 지금","88","read_payment_order_info"
"이번엔 검샥 결과에서 두 번째 거 선택해줘 해봐","76","select_search_result"
"일단옵션말고기본정보먼저읽어줘해줘지금","77","read_product_info"
"이번엔 개수 삼으로 조절해줘 좀","86","adjust_item_quantity"
"이번엔 상세페이지 핵심만 읽어줘 부탁드립니다부탁","77","read_product_info"
"바로 반품 신청 진행해줘 해줘","93","request_exchange_return"
"주문내역 삭제해줘 해줄래 해봐","94","delete_order_history"
"이번 주 식단 요약해줘","0","unknown"
"찜 상태로 바꿔줘 부탁해 해주이소","82","click_wishlist"
"이번엔이 상품 즉시 주문할래","80","click_buy_now"
"방금 본 상품 기준으로 이 제품 어떤 건지 설명해줘 가능해","77","read_product_info"
"이번 주문 기준으로 일단 일인용 전기포트 검샥해 해줘","69","search_products"
"오후 알람 요약해줘","0","unknown"
"이번 주문 기준으로 잠깐 옵선 이개로 조정해줘 먼저","78","update_product_option"
"방금 본 상품 기준으로 교환 및 반품 신청해 부탁해","93","request_exchange_return"
"이번 주문 기준으로 급한데 검색 결과를 하나씩 불러줘 바로","75","read_search_results"
"체크박스 눌러서 선택해줘 좀","84","select_cart_item"
"먼저 이 상품 찜 목록에 넣어줘 해줘","82","click_wishlist"
"지금 관심상품으로 저장해주라","82","click_wishlist"
"옵션 빨간색으로 바꿔줘","78","update_product_option"
"여기서 로가웃할게 해줘","73","click_logout"
"바로 내 주문 배송조회 들어가좀","92","click_track_delivery"
"잠깐 결재 완료 처리해줘 해줘","89","submit_payment"
"방금 본 상품 기준으로 잠깐 택배 조회 화면 열어줘 지금","92","click_track_delivery"
"지금 구매 전에 장바꾸니에 넣어줘 해줘 부탁","79","click_add_to_cart"
"현재 페이지에서 지금 결제 페이지 주문 내용 알려줘 해주이소","88","read_payment_order_info"
"지금 화면에서 찜 상태로 바꿔줘 해줘","82","click_wishlist"
"다음 주 회의 시간 알려줘","0","unknown"
"방금 본 상품 기준으로 최근 주문 내역 보게 이동해줘 해주이소","70","click_order_history"
"현재페이지에서 지금 장바꾸니 화면 보여줘 부탁해 지금","71","click_cart"
"주말 알람 확인해줘","0","unknown"
"이번 주문 기준으로 잠깐 이 페이지 가능한 작업 목록 보여줘 해줘 바로","74","read_current_page_actions"
"지금 화면에서 지금 장바꾸니 화면 보여줘 좀 지금","71","click_cart"
"지금 옵션 말고 기본 정보 먼저 읽어줘 해줘","77","read_product_info"
"지금 화면에서 이 물건 정보 한 번 훑어줘","77","read_product_info"
"현재 페이지에서 이번엔 배송 현황 확인 버튼 눌러줘 해주세요","92","click_track_delivery"
"지금 화면에서 이번엔 어떤 상품 몇 개 샀는지 알려주라","91","read_order_detail"
"택배 조회 화면 열어줘","92","click_track_delivery"
"방금본 상품 기준으로 결제 직전 정보 읽어줘","88","read_payment_order_info"
"현재 페이지에서 급한데 지금 장바구니 화면 보여줘 가능해 해주이소","71","click_cart"
"지금 화면에서 지금 구매하기 눌러주라 해줘","80","click_buy_now"
"이번 주문 기준으로 일단 가능한 버튼들 설명해줘 해줄래","74","read_current_page_actions"
"지금 일단 장바꾸니 추가해 부탁드립니다","79","click_add_to_cart"
"바로 히어비로 되돌아가","68","go_hearbe"
"주문내역에서 숨겨줘 부탁해 먼저","94","delete_order_history"
"현재 페이지에서 잠깐 로그인 시작해줘 좀","72","click_login"
"이번주문 기준으로 이번엔 카트에 뭐 담겼는지 말해줘","83","read_cart_items"
"이번 주문 기준으로 이번엔 결과 페이지 내용 읽어줘 부탁드립니다","75","read_search_results"
"지금식단기록해줘","0","unknown"
"지금 화면에서 잠깐 반품 진행 버튼 눌러줘 해줄래","93","request_exchange_return"
"현재페이지에서이번엔최종주문확인정보말해줘","88","read_payment_order_info"
"지금 화면에서 이번엔 히어비홈페이지 열어줘","68","go_hearbe"
"지금결재페이지주문내용알려줘해줄래지금","88","read_payment_order_info"
"먼저 이거 말고 다른 색상 있는지 검샥해줘부탁해","69","search_products"
"방금 본 상품 기준으로 주문 상세 내역 설명해줘","91","read_order_detail"
"잠깐 옵션 다른 걸로 다시 골라줘 가능해 바로","78","update_product_option"
"이번 주문 기준으로 먼저 선택한 상품 해제해줘 해줘","85","unselect_cart_item"
"다음 주 수면 기록 확인해줘","0","unknown"
"지금 현재페이지에서 가능한 작업 알려줘 해줘 해봐","74","read_current_page_actions"
"바로 가격 제일 낮은 결과 선택해주이소 가능해","76","select_search_result"
"잠깐 옵션에서 대용량으로 바꿔주세요 부탁해 바로","78","update_product_option"
"방금 본 상품 기준으로 어떤 상품 몇 개 샀는지 알려줘 부탁해","91","read_order_detail"
"지금 화면에서 지금 배송 진행상황 눌러줘 부탁드립니다","92","click_track_delivery"
"내가 내야 할 돈 얼마인지 말해주이소 부탁","87","read_order_amount"
"로그인 풀어줘","73","click_logout"
"방금 본 상픔 기준으로 바로 지금 담아둔 상품 뭐 있어 좀","83","read_cart_items"
"현재 페이지에서 선택 안 된 상픔 선택해줘 좀","84","select_cart_item"
"바로 일단 찜해둘게 해주세요","82","click_wishlist"
"이주문건자세히알려줘바로","91","read_order_detail"
"일단 나중에 보게 찜해둬 해줘","82","click_wishlist"
"바로 닭가슴살 찾아줘","69","search_products"
"잠깐리부많은상픔으로들어가줘해줘","76","select_search_result"
"장바꾸니 내용 확인해줘","83","read_cart_items"
"이번엔 쿠팡 계정 로과웃해","73","click_logout"
"이번엔 이 상품 수량 이개로 바꿔줘","86","adjust_item_quantity"
"쇼핑끝났으니히어비로복귀해지금","68","go_hearbe"
"결제 진행 버튼 눌러","89","submit_payment"
"주문내옉페이지열어줘해봐","70","click_order_history"
"오후회의시간계산해줘","0","unknown"
"오늘 일정 확인해줘","0","unknown"
"장바꾸니 수랑 오개로 변경해 부탁드립니다","86","adjust_item_quantity"
"먼저 나중에 보게 찜해둬 해줄래","82","click_wishlist"
"지금 페이지 안내해줘 해줄래 해봐","74","read_current_page_actions"
"옵선을 세트 구성으로 바꿔줘 부탁드립니다","78","update_product_option"
"이번엔카트항목선택해","84","select_cart_item"
"먼저 선택 상태 원래대로 돌려줘 부탁해","85","unselect_cart_item"
"급한데수량을일개로되돌려줘","86","adjust_item_quantity"
"일단 선택 해제 버튼 눌러줘","85","unselect_cart_item"
"이번주문기준으로주문내역에서숨겨줘","94","delete_order_history"
"장바꾸니 말고 바로 주문해 해줘","80","click_buy_now"
"먼저히어비홈으로바로이동해줘","68","go_hearbe"
"먼저 최근 리뷰 요약해줘 좀","81","read_reviews"
"잠깐 식단 확인해줘","0","unknown"
"지금 화면에서 검색 결과를 하나씩 불러줘 부탁해","75","read_search_results"
"이번엔결제 완료 처리해줘 가능해","89","submit_payment"
"전체 선택 해제해줘 부탁해","85","unselect_cart_item"
"현재 페이지에서 급한데 장바구니에 담긴 상픔 읽어줘 해줘","83","read_cart_items"
"현재 페이지에서 급한데 상세 주문 정보 확인해줘 해줘","91","read_order_detail"
"지금 화면에서 일단 여기서 지원되는 동작 읽어줘 가능해 해주이소","74","read_current_page_actions"
"현재 페이지에서 먼저 로그아웃 처리해줘","73","click_logout"
"방금 본 상품 기준으로 장바구니 수량 오개로 변경해 부탁해","86","adjust_item_quantity"
"현재페이지에서유산균상품검색해주이소","69","search_products"
"방금 본 상픔 기준으로 지금 로긴 시작해줘 부탁해","72","click_login"
"이번엔 로그인 시작해주라 가능해","72","click_login"
"현재페이지에서이번엔키보드상품검색해줘","69","search_products"
"현재 페이지에서 급한데 먼저 로긴부터 할게 부탁","72","click_login"
"방금본상품기준으로잠깐체크박스꺼줘","85","unselect_cart_item"
"주문번호 기준으로 상세 보여줘 부탁","91","read_order_detail"
"잠깐 옵션에서 블랙 선택해줘 부탁해","78","update_product_option"
"급한데 일단 찜해둘게 부탁드립니다 해봐","82","click_wishlist"
"지금 화면에서 이번엔 결재 페이지 주문 내용 알려줘 부탁해","88","read_payment_order_info"
"지금 바로 결제할게 좀 해봐","89","submit_payment"
"화면 기준으로 가능한 명령 알려줘 해주세요","74","read_current_page_actions"
"급한데 수랑 한 개줄여줘 해줄래","86","adjust_item_quantity"
"바로 쿠팡 로그인하러 가","72","click_login"
"이번 주문 기준으로 잠깐 화면 기준으로 가능한 명령 알려줘","74","read_current_page_actions"
"일단 주문 상세 정보 읽어줘 부탁드립니다 지금","91","read_order_detail"
"방금 본 상품 기준으로 무선 이어폰 검색해 해줄래","69","search_products"
"먼저 키보드 상품 검색해줘","69","search_products"
"이번엔 선택된 상픔들 읽어주라 부탁드립니다 부탁","83","read_cart_items"
"바로 상픔금액 플러스 배송비 합계 알려줘 바로","87","read_order_amount"
"잠깐 현재 장바꾸니 상태 알려줘 부탁해","83","read_cart_items"
"방금 본 상픔 기준으로 먼저 지금 선택 처리해줘 좀","84","select_cart_item"
"먼저 장바구니 페이지 열기 해주이소","71","click_cart"
"지금 화면에서 급한데 찜 상태로 바꿔줘","82","click_wishlist"
"이번엔 수량 한 개 줄여줘 해주이소","86","adjust_item_quantity"
"현재 페이지에서 급한데 지금 화면에서뭐 할 수 있어","74","read_current_page_actions"
"옵션 다른 걸로 다시 골라줘","78","update_product_option"
"이번 주문 기준으로 주문 확정하고 결재해주세요 부탁해","89","submit_payment"
"지금 화면에서 내 주문 리스트로 이동 해줄래","70","click_order_history"
"현재 장바구니상태 알려줘 지금","83","read_cart_items"
"저녁 날씨 확인해줘","0","unknown"
"이번 주문 기준으로 바로 지금 결제 진행해 해주세요","89","submit_payment"
"지금 화면에서 지금 배송정보 추적해줘 부탁드립니다","92","click_track_delivery"
"이항목주문수량조정해줘","86","adjust_item_quantity"
"지금 화면에서 총결제금액 얼마야","87","read_order_amount"
"지금 화면에서 급한데 로긴 단계로 넘어가 먼저","72","click_login"
"바로 후기 좋은 순으로 몇 개만 읽어줘","81","read_reviews"
"먼저일단장바꾸니추가해부탁","79","click_add_to_cart"
"주문 목록에서 이 항목 삭제해해줄래","94","delete_order_history"
"총 주문 금액 보여줘 해줘","87","read_order_amount"
"일단 찜해둘게 부탁드립니다","82","click_wishlist"
"화면기준으로가능한명령알려줘","74","read_current_page_actions"
"바로 반품 진행 버튼 눌러주라","93","request_exchange_return"
"오늘 운동 계획 계산해줘","0","unknown"
"지금 여기서 로그아웃할게 지금","73","click_logout"
"먼저 만족도 높은 리부 먼저 읽어줘 가능해 바로","81","read_reviews"
"리뷰 많은 상품으로 들어가줘","76","select_search_result"
"여기서 로과웃할게 부탁드립니다","73","click_logout"
"잠깐 쇼핑 끝났으니 히어비로 복귀해","68","go_hearbe"
"방금 본 상품 기준으로 바로 어떤 상품 결제하는지 읽어줘 부탁해 부탁","88","read_payment_order_info"
"두 번째 상픔만 선택해줘 가능해","84","select_cart_item"
"현재 페이지에서 일단 결제버튼 실행해 부탁해","89","submit_payment"
"지금 화면에서 장바꾸니 리스트 요약해줘 먼저","83","read_cart_items"
"바로 장바꾸니 말고 바로 주문해 해줄래 먼저","80","click_buy_now"
"잠깐 검샥된 제품 이름만 읽어줘 해봐","75","read_search_results"
"닭가슴살 찾아줘 좀","69","search_products"
"방금 본 상픔 기준으로 휴지 제일 많이 사는 거 검샥해줘","69","search_products"
"현재 페이지에서 잠깐 상세 주문 정보 확인해주세요 가능해","91","read_order_detail"
"잠깐 내가 담은 거 보자","71","click_cart"
"이번 주문 기준으로 일단 내가 내야 할 돈 얼마인지 말해줘","87","read_order_amount"
"지금 선택한 옵션 취소하고 새로 선택해주이소해봐","78","update_product_option"
"잠깐 옵선 빨간색으로 바꿔줘","78","update_product_option"
"지금 화면에서 바로 후기 좋은 순으로 몇 개만 읽어줘 바로","81","read_reviews"
"이번주문기준으로바로찜등록해줘해주세요","82","click_wishlist"
"지금 화면에서 이번엔 지금 담아둔 상품 뭐 있어 해줄래","83","read_cart_items"
"일단 구매하기 눌러줘 먼저","80","click_buy_now"
"급한데 히어비홈페이지 열어줘 부탁드립니다","68","go_hearbe"
"방금 본 상픔 기준으로 제품 스펙 정리해서 말해줘 해주이소","77","read_product_info"
"일단 주문 확정하고 결제해줘","89","submit_payment"
"옵선에서 대용량으로 바꿔줘 먼저","78","update_product_option"
"일단 로긴 풀어줘 해주이소","73","click_logout"
"일단 주문 상세 정보 읽어줘 해봐","91","read_order_detail"
"이번엔 이 상품 옵선 종류 뭐 있어 가능해 바로","95","read_option_info"
"리뷰 핵심만 정리해줘 지금","81","read_reviews"
"이번엔 여기서 지원되는 동작 읽어줘 해줄래","74","read_current_page_actions"
"급한데 결과화면 요약해줘 바로","75","read_search_results"
"리부에서 단점 위주로 알려줘 좀","81","read_reviews"
"방금 본 상품 기준으로 일단 내 주문목록으로 가","70","click_order_history"
"지금 카트 상품명과 수량 읽어줘 해봐","83","read_cart_items"
"이번주문기준으로지금주문내역삭제해줘해줘","94","delete_order_history"
"일단 검색된 상픔 목록 확인해주이소","75","read_search_results"
"현재 페이지에서수량을 일개로 되돌려줘 해주세요 먼저","86","adjust_item_quantity"
"지금 상품 요약해줘 부탁드립니다","77","read_product_info"
"현재 페이지에서 먼저 주문 상세 내역 설명해줘 가능해","91","read_order_detail"
"잠깐 일정 알려줘","0","unknown"
"현재 페이지에서 지금 유산균 상품 검색해줘","69","search_products"
"이번엔반품신청진행해줘부탁해","93","request_exchange_return"
"이번 주문 기준으로 첫 번째 상품 눌러줘 해줘","76","select_search_result"
"이번 주문 기준으로 이번엔 담긴 물건 확인하자 부탁","71","click_cart"
"이번 주문 기준으로 먼저 휴지 제일 많이 사는 거 검샥해줘","69","search_products"
"잠깐 두 번째 상품만 선택해줘","84","select_cart_item"
"이번 주문 기준으로 먼저 주문 배송 조회 메뉴 눌러줘 해줘 해봐","70","click_order_history"
"지금 결재 전 주문 내역 확인해줘 좀","88","read_payment_order_info"
"먼저 상품 선택 취소해줘 해줄래","85","unselect_cart_item"
"먼저 해당 주문 기록 제거해줘","94","delete_order_history"
"이번엔 원래 히어비 화면으로 돌아가자 해주세요","68","go_hearbe"
"현재페이지에서내가내야할돈얼마인지말해줘먼저","87","read_order_amount"
"현재페이지에서일단지금보이는항목하나열어줘좀","76","select_search_result"
"현재 페이지에서 지금 택배 어디쯤인지 조회해줘 먼저","92","click_track_delivery"
"이번 주문 기준으로 먼저 주문 상세 내역설명해줘","91","read_order_detail"
"주문 내역 정리하려고 이거 삭제해","94","delete_order_history"
"일단 첫 번째 항목 선택 취소해 부탁드립니다 부탁","85","unselect_cart_item"
"이번 주문 기준으로 지금 이대로 결제 확정해줘 해줄래","89","submit_payment"
"먼저 지금 화면에서 뭐 할 수 있어","74","read_current_page_actions"
"현재 페이지에서 지금 검색 결과 몇 개인지랑 같이 읽어줘","75","read_search_results"
"먼저 쇼핑 끝났으니 히어비로 복귀해 부탁해","68","go_hearbe"
"먼저수량변경적용해줘해줘","86","adjust_item_quantity"
"바로 구매 전에 장바꾸니에 넣어줘","79","click_add_to_cart"
"일단히어비첫화면으로보내줘","68","go_hearbe"
"먼저 결제 완료 처리해줘 가능해","89","submit_payment"
"방금 본 상픔 기준으로 잠깐전체 선택 해제해주라 해주세요 지금","85","unselect_cart_item"
"급한데 내 계정으로 로그인할래","72","click_login"
"바로쿠팡에서 비타민 찾아봐 해줘 바로","69","search_products"
"아침 회의 시간 계산해줘","0","unknown"
"휴지 제일 많이 사는 거 검샥해주이소 부탁드립니다","69","search_products"
"이번 주문 기준으로 한 번 담아둘게 장바꾸니 추가 해줄래 바로","79","click_add_to_cart"
"이번 주문 기준으로 이번엔 지금 배송 위치 보여줘","92","click_track_delivery"
"급한데 이거 말고 다른 색상 있는지 검색해주라","69","search_products"
"아침 지하철 시간 계산해줘","0","unknown"
"방금 본 상품 기준으로 이번엔 주문내역 페이지 열어줘","70","click_order_history"
"이번 주문 기준으로 바로 지금 담아둔 상픔 뭐 있어 먼저","83","read_cart_items"
"일단 담긴 물건 확인하자 해줘 먼저","71","click_cart"
"바로 방금 본 항목 선택 상태로 바꿔","84","select_cart_item"
"일단 택배어디쯤인지 조회해줘","92","click_track_delivery"
"먼저 내 주문 리스트로 이동","70","click_order_history"
"지금 선택 처리해줘 해줄래","84","select_cart_item"
"지금 화면에서 이번엔 히어비 메인 페이지로 전환해줘","68","go_hearbe"
"현재 페이지에서 상품 개수 마이너스 일 해줘","86","adjust_item_quantity"
"잠깐 환불 반품 신청해줘 부탁드립니다","93","request_exchange_return"
"주문 상세 정보 읽어줘","91","read_order_detail"
"이번주문기준으로이상품찜목록에넣어줘해주이소","82","click_wishlist"
"일단 지난 주문 확인 화면으로 이동해 해주세요","70","click_order_history"
"방금 본 상픔 기준으로 먼저 주문내옉 페이지 열어줘 해주세요 부탁","70","click_order_history"
"일단 담긴 물건확인하자","71","click_cart"
"방금본상품기준으로일단이제품담기클릭해줘가능해","79","click_add_to_cart"
"방금 본 상품 기준으로 이번엔 카트 페이지로 이동해","71","click_cart"
"현재 페이지에서 먼저 지난 주문 확인 화면으로 이동해","70","click_order_history"
"이번엔 히어비 홈페이지 열어줘 부탁해","68","go_hearbe"
"현재 페이지에서 지금 품절 아닌 옵션만 읽어줘","95","read_option_info"
"현재 페이지에서 급한데 더 이상 안 보이게 삭제해줘","94","delete_order_history"
"지금 한줄 후기들 먼저 보여줘","81","read_reviews"
"지금 화면에서 이번엔 지난 주문 확인 화면으로 이동해","70","click_order_history"
"이번 주문 기준으로 지금 지금 보는상품 담아줘","79","click_add_to_cart"
"이번 주문 기준으로 택배 어디쯤인지 조회해줘 해줄래","92","click_track_delivery"
"급한데 장바구니 말고 바로 주문해 부탁드립니다 먼저","80","click_buy_now"
"지금바로결제할게부탁해","89","submit_payment"
"지금 화면에서 바로 후기 좋은 순으로 몇 개만 읽어줘","81","read_reviews"
"로그인 단계로 넘어가","72","click_login"
"지금 화면에서 이 제품 담기 클릭해주라 해줘","79","click_add_to_cart"
"지금 이 상픔 수량 이개로 바꿔주라","86","adjust_item_quantity"
"상픔명 가격 로켓배송 여부 알려줘","77","read_product_info"
"현재 페이지에서 이번엔 주문 기록 보러 가자 부탁해","70","click_order_history"
"지금화면에서 지금 주문조회 페이지 들어가 가능해","70","click_order_history"
"방금 본 상품 기준으로 일단 사이즈를 이 칠 영으로 바꿔줘 부탁해","78","update_product_option"
"바로 히어비 홈페이지 열어줘","68","go_hearbe"
"여기서지원되는동작읽어줘가능해해봐","74","read_current_page_actions"
"이번 주문 기준으로 지금 카트 페이지로 이동해","71","click_cart"
"쿠팡에서비타민 찾아봐","69","search_products"
"지난 주문 확인 화면으로 이동해","70","click_order_history"
"지금 알람 알려줘","0","unknown"
"만족도 높은 리뷰 먼저 읽어줘 부탁드립니다 해주이소","81","read_reviews"
"이번 주문 기준으로 일단 쇼핑 끝났으니 히어비로 복귀해","68","go_hearbe"
"이번 주문 기준으로 일단 같은 상픔 장바구니에 추가해 해줘","79","click_add_to_cart"
"방금본상품기준으로잠깐결제전주문내역확인해줘해주세요","88","read_payment_order_info"
"현재 페이지에서 카트로 바로 가 부탁","71","click_cart"
"지금관심상품으로 저장해줘","82","click_wishlist"
"이번엔 결제 요청 보내줘","89","submit_payment"
"현재 페이지에서 바로 가격 제일 낮은 결과 선택해줘 부탁","76","select_search_result"
"로긴 화면 열어줘먼저","72","click_login"
"지금 화면에서 급한데 배송 현황 확인 버튼 눌러줘","92","click_track_delivery"
"이번 주문 기준으로 먼저 이 화면 기능 읽어줘 지금","74","read_current_page_actions"
"이번엔 상품 요약해줘","77","read_product_info"
"먼저 리뷰에서 단점 위주로 알려줘 가능해","81","read_reviews"
"일단내 계정에서 나가기 지금","73","click_logout"
