"text","label_id","label"
"쇼핑몰 페이지 화면에서 마이페이지 열어 해줘","33","click_my_page"
"이용 약관 보기 눌러 해줘","22","click_view_terms"
"계정나갈게로그아웃해?","30","click_logout"
"좀 지금 회원가입 페이지인데 이영약관 화면 보여줘","22","click_view_terms"
"로그인들어가?","16","click_login"
"지금 메인 화면인데 앱 다운로드 실행해줘 부탁해","11","click_app_download"
"로그인 페이지 화면에서 쇼핑몰 화면 열어?","8","go_mall"
"로긴진행해줘","16","click_login"
"지금 쇼핑 화면인데 장바고니에 넣어줘?","32","click_cart"
"좀 회원가입 제출 해줄래?","25","submit_signup"
"지금 장바구니 보고 있는데 쇼핑몰 이동 가능?","8","go_mall"
"바로 지금 체크 끄기?","15","uncheck_keep_login"
"일단 지금 쇼핑몰 페이지 보고 있는데, 마이페이지 열어 해봐","33","click_my_page"
"일단 화면 내용 읽어 해줄래?","34","read_page"
"지금 주문내역 보고 있는데 선택해 할래?","14","check_keep_login"
"지금 주문내역 보고 있는데 로그인 처리해 가능?","16","click_login"
"지금 메인 화면인데 지금 화면 읽어줘","7","read_hearbe_guide"
"지금 장바구니 보고 있는데 회원가입 페이지 화면에서 약관 동의 체크박스 눌러줘","24","check_terms_agreement"
"좀 지금 아이디 찾기 해줄래?","17","click_find_id"
"지금 메인 화면인데 전화번호 적어?","26","input_phone_number"
"지금 로그인 화면인데 좀 비밀 번호 확인 입력해줘","27","input_password_confirm"
"좀 지금 회원정보 페이지 보고 있는데, 비밀 번호 변경하기 눌러줘 해","35","click_change_password"
"지금 바로 회웝가입 열어?","19","click_signup"
"퇴근하고 빨래 하기 싫다","0","unknown"
"지금 회원가입 화면인데 회원가입 진행해?","19","click_signup"
"지금로그인페이지보고있는데,현재페이지정보읽어줘?","6","read_current_page_actions"
"저녁에 독서 할까?","0","unknown"
"주문자세히보기해","37","click_order_detail"
"지금 로그인 화면인데 회원가입 페이지에서 약관 동의 체크박스 눌러줘","24","check_terms_agreement"
"지금 쇼핑 화면인데 장바 구니 담아줘","32","click_cart"
"지금 로그인 화면인데 로과웃 눌러 가능?","30","click_logout"
"회웝가입 페이지인데 이용약관 화면 보여줘","22","click_view_terms"
"비번호 찾기 들어가 할래?","18","click_find_password"
"비밀 번호 찾기 진행해줘 가능해?","18","click_find_password"
"아침에 독서 할까?","0","unknown"
"지금 주문내역 보고 있는데 지금 상품조회 진행해","38","click_product_view"
"좀 가능한 쇼핑몰 읽어주세요","29","read_available_marketplaces"
"오늘 음악 듣기 하기 싫다","0","unknown"
"지금 로그인 화면인데 지금 이메일 써","28","input_email"
"지금 지원 쇼핑몰 말해줘","29","read_available_marketplaces"
"일단 지금 비밀번호 적어 해","13","input_password"
"지금 메인 화면인데 지금 이용 가능한 쇼핑몰 알려줘","29","read_available_marketplaces"
"지금 바로 비밀번호 변경하기 열어 해줄래?","35","click_change_password"
"지금 장바구니 보고 있는데 상품조회 할래?","38","click_product_view"
"지금 장바구니 보고 있는데 비번호 확인 입력","27","input_password_confirm"
"좀 지금 공유 쇼핑 입장 버튼 눌러 해줄래?","10","click_shared_shopping_entry"
"지금 회원가입 화면인데 메인 페이지 화면에서 공유 쇼핑 시작해줘","10","click_shared_shopping_entry"
"일단 장바구니에 추가해줘 할래?","32","click_cart"
"좀 지금 앱 다운로드 버튼 들어가","11","click_app_download"
"일단 지금 이메일 주소 입력해봐","28","input_email"
"쇼핑몰 페이지 화면에서 현재 페이지 정보 읽어","6","read_current_page_actions"
"지금 주문내역 보고 있는데 아이디 입력해?","12","input_id"
"요즘 동네 한 바퀴 갈까?","0","unknown"
"이번 주말 식물 물주기 할까?","0","unknown"
"좀 로그인 페이지 화면에서 비번호 칸에 적어줘","13","input_password"
"지금 로그인 화면인데 회원가입 페이지에서 이용 약관 보기 눌러줘","22","click_view_terms"
"바로 이용약관 뭐야 해봐","23","read_terms"
"지금 로그인 유지 체크 해제 해줘","15","uncheck_keep_login"
"바로 아뒤 중복 확인?","20","click_check_id_duplicate"
"지금 회원가입 화면인데 주문 상세 조회 진행해 해봐","37","click_order_detail"
"로긴 페이지 화면에서 히어비 가이드 읽어줘","7","read_hearbe_guide"
"지금 메인 화면인데 로그인 페이지에서 히어비 소개해줘?","7","read_hearbe_guide"
"일단 아이디 찾기 클릭 해줘","17","click_find_id"
"지금 바로 회원탈퇴 열어 해봐","36","click_delete_account"
"좀 가능한 작업 알려줘 해","6","read_current_page_actions"
"지금 회원가입 화면인데 읽기 할래?","34","read_page"
"바로 이영약관 읽어주세요 해줘","23","read_terms"
"좀 지금 로그인 들어가","16","click_login"
"드라마 뭐 볼지 고민된다","0","unknown"
"좀 현재 페이지 읽어 해봐","34","read_page"
"일단 지금 이메일 넣어?","28","input_email"
"지금 주문내역 보고 있는데 쇼핑몰 이동","8","go_mall"
"일단 아이 디 찾기 눌러줘 해줄래?","17","click_find_id"
"일단 이용약관 화면 보여줘 해","22","click_view_terms"
"주문 상세 보기 열어주세요 해줄래?","37","click_order_detail"
"일단 메인 페이지인데 앱 다운로드 버튼 눌러 해","11","click_app_download"
"아이 디 넣어줄래?","12","input_id"
"지금 쇼핑 화면인데 지금 회원가입 페이지 보고 있는데, 아이 디 입력해줘","12","input_id"
"점심 먹고 방 정리 해볼래?","0","unknown"
"지금 회원가입 화면인데 계정 나갈게 로가웃해","30","click_logout"
"지금 로그인 화면인데 지금 회원탈퇴 들어가","36","click_delete_account"
"지금 아이디 중복 확인 들어가 해줄래?","20","click_check_id_duplicate"
"지금 쇼핑 화면인데 지금 회원가입 페이지인데 아이디 중복 확인해줘","20","click_check_id_duplicate"
"좀 로그인 상태 유지로 바꿔줘 해봐","14","check_keep_login"
"일단 지금 메일 주소 넣어 해줄래?","28","input_email"
"지금 회원가입 화면인데 이름 입력 해봐","21","input_name"
"공유 쇼핑 입장 버튼 열어?","10","click_shared_shopping_entry"
"지금 주문내역 보고 있는데 바로 아뒤 써","12","input_id"
"일단 쇼핑몰 페이지에서 장바 구니 담아줘 해","32","click_cart"
"일단 로그인 페이지에서 비밀번호 넣어 해봐","13","input_password"
"이번 주말 영화 보기 해야겠다","0","unknown"
"지금 장바구니 보고 있는데 좀 비밀번호 확인 입력해줘","27","input_password_confirm"
"지금 주문내역 보고 있는데 아뒤 중복 확인 열어?","20","click_check_id_duplicate"
"로그인 페이지 화면에서 희어비 가이드 읽어줘 해줄래?","7","read_hearbe_guide"
"지금 메인 화면인데 이용약관 보기 눌러","22","click_view_terms"
"지금 쇼핑 화면인데 지금 전화번호 작성해","26","input_phone_number"
"지금 쇼핑 화면인데 로그인 페이지인데 히어비로 이동해","4","go_hearbe"
"일단 약관 동의 체크박스 눌러 해줄래?","24","check_terms_agreement"
"좀 지금 상품조회 눌러","38","click_product_view"
"일단 바로 쿠팡 이동 열어","31","click_go_coupang"
"지금 로그인 화면인데 주문내역 페이지에서 주문 상세 조회해줘?","37","click_order_detail"
"좀 바로 앱 다운로드 버튼 눌러 해","11","click_app_download"
"바로 지금 마이페이지 눌러 해줘","33","click_my_page"
"좀 회원정보 페이지에서 지금 화면 내용 읽어줘 해","34","read_page"
"지금 상품조회","38","click_product_view"
"저녁에 독서 하고 싶다","0","unknown"
"지금 로그인 페이지에서 회웝가입 진행해줘","19","click_signup"
"좀 지금 장바구니 페이지 보고 있는데, 상품조회 눌러 해","38","click_product_view"
"로가웃해해봐","30","click_logout"
"좀 바로 쇼핑몰 이동?","8","go_mall"
"바로 지금 체크 끄기 해","15","uncheck_keep_login"
"좀 지금 희어비 홈 보고 있는데, 공유 쇼핑 입장 버튼 눌러줘 해봐","10","click_shared_shopping_entry"
"요즘 영화 보기 하고 싶다","0","unknown"
"지금 회원가입 화면인데 비밀번호 작성해","13","input_password"
"좀 히어비 가이드 알려줘 해줘","7","read_hearbe_guide"
"지금 회원가입 화면인데 쇼핑몰로 가","8","go_mall"
"지금 이용 약관 화면 보여줘 해","22","click_view_terms"
"지금 주문내역 보고 있는데 회원가입 진행해?","19","click_signup"
"바로 쇼핑몰 페이지에서 내 정보 페이지 보여 해줘","33","click_my_page"
"지금 메인 화면인데 회원가입 페이지 화면에서 비밀 번호 확인 칸에 적어줘","27","input_password_confirm"
"지금 로그인 화면인데 지금 히어비 접속해줘?","4","go_hearbe"
"이번 주 영화 보기 하기 싫다","0","unknown"
"내일 스트레칭 해야겠다","0","unknown"
"바로 지금 이영약관 읽어줘?","23","read_terms"
"지금 장바고니 담아 할래?","32","click_cart"
"바로 지금 장바고니 담아 해","32","click_cart"
"이번 주 공원 가서 바람 쐴까?","0","unknown"
"바로 회원가입 들어가 해봐","19","click_signup"
"요즘 헬스장 다녀올까?","0","unknown"
"좀 쇼핑몰 이동 해봐","8","go_mall"
"지금 장바구니 보고 있는데 지금 회원정보 페이지 보고 있는데, 비밀번호 변경하기 눌러줘","35","click_change_password"
"머리가 복잡하다 어떻게 하지","0","unknown"
"요즘 운동 해야겠다","0","unknown"
"지금 바로 비밀번호 찾기 들어가 해줘","18","click_find_password"
"지금 주문내역 보고 있는데 체크 표시해?","14","check_keep_login"
"지금 장바구니 보고 있는데 지금 쇼핑몰 페이지인데 이용 가능한 쇼핑몰 알려줘?","29","read_available_marketplaces"
"바로 지금 아이디 입력 해봐","12","input_id"
"지금 쇼핑 화면인데 로그인 페이지 화면에서 비밀번호 작성해","13","input_password"
"바로 장바구니에 넣어 할래?","32","click_cart"
"지금 로그인 페이지 보고 있는데, 비번호 찾기 눌러줘 해줘","18","click_find_password"
"좀 지금 이름 넣어줘 해","21","input_name"
"회원가입 페이지인데 비밀번호 확인값 넣어 해줄래?","27","input_password_confirm"
"지금 회원가입 화면인데 지금 이메일 써","28","input_email"
"지금 로그인 화면인데 지금 화면 알려줘?","34","read_page"
"지금 쇼핑 화면인데 아이디 적어?","12","input_id"
"지금 회원가입 화면인데 성함 입력해 해줘","21","input_name"
"지금 메인 화면인데 장바고니 열어","32","click_cart"
"바로그인 페이지에서 자동 로긴 체크 풀어줘 해줄래?","15","uncheck_keep_login"
"요즘 일기 쓰기 하기 싫다","0","unknown"
"바로긴 상태 유지 해제해줘","15","uncheck_keep_login"
"오늘 드라마 보기 하고 싶다","0","unknown"
"바로 회원정보 페이지에서 비밀번호 변경 메뉴로 가줘 해봐","35","click_change_password"
"지금 로그인 화면인데 회원탈퇴 들어가","36","click_delete_account"
"일단 바로 비번호 확인 입력 해","27","input_password_confirm"
"좀 지금 회원가입 페이지인데 이영약관 화면 보여줘 해봐","22","click_view_terms"
"일단 회원정보 페이지에서 비밀 번호 변경 화면 열어줘 해봐","35","click_change_password"
"바로 지금 아뒤 적어 해봐","12","input_id"
"좀 마이페이지 눌러 해줄래?","33","click_my_page"
"좀 지금 공유 쇼핑 입장 버튼 해줘","10","click_shared_shopping_entry"
"지금 로그인 화면인데 마이페이지 열어 할래?","33","click_my_page"
"좀 지금 마이페이지","33","click_my_page"
"지금 메인 화면인데 바로 상품조회 열어","38","click_product_view"
"좀 로그인 페이지 화면에서 쇼핑몰 화면 열어줘","8","go_mall"
"지금 로그인 화면인데 회원탈퇴 눌러?","36","click_delete_account"
"일단 로그인 페이지 화면에서 로그인 버튼 눌러줘","16","click_login"
"지금 좀 아이디 중복 조회해줘","20","click_check_id_duplicate"
"좀 지금 로그인 페이지인데 비밀 번호 재설정 페이지로 가줘?","18","click_find_password"
"지금 로그인 화면인데 회원가입 진행해 해?","19","click_signup"
"일단 쇼핑몰 페이지인데 쇼핑몰 목록 읽어줘?","29","read_available_marketplaces"
"바로 회원가입 페이지에서 아이 디 중복 검사해줘","20","click_check_id_duplicate"
"좀 바로 장바구니 담아줘 해봐","32","click_cart"
"지금 주문내역 보고 있는데 체크 풀어?","15","uncheck_keep_login"
"지금 회원가입 화면인데 바로 마이페이지 눌러","33","click_my_page"
"일단 바로 장바구니에 넣어 해봐","32","click_cart"
"바로그인 페이지 화면에서 로그인 유지 켜줘 해봐","14","check_keep_login"
"일단 이용약관 화면 보여?","22","click_view_terms"
"히어브 홈에서 앱 다운로드 진행해봐","11","click_app_download"
"바로 지금 희어비 사용법 알려줘 해봐","7","read_hearbe_guide"
"지금 회원가입 제출해 할래?","25","submit_signup"
"바로 메인 페이지 화면에서 공유 쇼핑 들어가줘 해","10","click_shared_shopping_entry"
"지금 로그인 화면인데 바로 체크 표시해","14","check_keep_login"
"좀 쇼핑몰 페이지에서 장바 구니 담아줘 해줘","32","click_cart"
"지금 바로 아뒤 값 넣어 해봐","12","input_id"
"요즘 창문 열기 할까?","0","unknown"
"지금 메인 화면인데 로그인 페이지에서 자동 로긴 체크해줘","14","check_keep_login"
"지금 장바구니 보고 있는데 전화번호 입력 해봐","26","input_phone_number"
"동의처리해줘","24","check_terms_agreement"
"비번호 찾기 열어줄래?","18","click_find_password"
"일단 지금 비번호 확인 적어?","27","input_password_confirm"
"지금 회원가입 화면인데 지금 히어비로 가","4","go_hearbe"
"지금 회원가입 화면인데 히어비 홈에 와 있어, 앱 다운로드 진행해줘","11","click_app_download"
"좀 로그인 페이지 화면에서 비번호 칸에 적어줘 해줘","13","input_password"
"일단 로그인 유지 꺼 해줘","15","uncheck_keep_login"
"저녁에 요리 하고 싶다","0","unknown"
"바로 장바고니에 넣어","32","click_cart"
"지금화면읽어줘","6","read_current_page_actions"
"좀 히어비 홈에 와 있어, 공유 쇼핑 들어가줘 해봐","10","click_shared_shopping_entry"
"내일 강변 갈까?","0","unknown"
"지금 회원가입 화면인데 지금 회원가입 페이지 보고 있는데, 비밀번호 입력해줘","13","input_password"
"지금 회원가입 페이지에서 약관 보기 열어 해줘","22","click_view_terms"
"좀 로그인 페이지에서 자동 로그인 체크 풀어줘 해줘","15","uncheck_keep_login"
"좀 지금 비번호 확인 넣어 해줄래?","27","input_password_confirm"
"지금 주문내역 보고 있는데 회원정보 페이지에서 계정 삭제 시작해줘?","36","click_delete_account"
"일단 지금 로그인 페이지인데 비밀 번호 찾기 열어줘 해줄래?","18","click_find_password"
"지금 메인 화면인데 지금 회원정보 페이지인데 탈퇴 메뉴 열어","36","click_delete_account"
"바로 쇼핑몰 페이지에서 장바고니 담아줘?","32","click_cart"
"일단 지금 히어비 홈 보고 있는데, 앱 다운로드 버튼 눌러 해줘","11","click_app_download"
"점심 먹고 요리 해야겠다","0","unknown"
"지금 장바구니 보고 있는데 이용약관 보기 진행해 해봐","22","click_view_terms"
"바로 회원탈퇴 클릭 해봐","36","click_delete_account"
"좀 쇼핑몰 페이지인데 쿠팡 화면 열어 해줄래?","31","click_go_coupang"
"지금 메인 화면인데 쿠팡 이동 클릭 할래?","31","click_go_coupang"
"요즘 기분이 좋다","0","unknown"
"회원가입페이지에서전화번호작성해줘?","26","input_phone_number"
"바로 장바구니에 넣어줘 해봐","32","click_cart"
"일단 바로 회원탈퇴 눌러","36","click_delete_account"
"지금 메인 화면인데 로그인 페이지 화면에서 회원가입으로 이동해","19","click_signup"
"아침에 빨래 하기 싫다","0","unknown"
"쇼핑몰 페이지 보고 있는데, 히어비 가이드 읽어줘 해줄래?","7","read_hearbe_guide"
"일단 쇼핑몰 페이지 화면에서 현재 페이지와 기능 안내해줘","6","read_current_page_actions"
"좀 회원가입 페이지 화면에서 이메일 칸에 적어?","28","input_email"
"지금 장바구니 보고 있는데 전화번호 입력","26","input_phone_number"
"저녁에 낮잠 하고 싶다","0","unknown"
"지금 메인 화면인데 가능한 쇼핑몰 요약해 해봐","29","read_available_marketplaces"
"지금 로그인 화면인데 지금 회원가입 페이지인데 아이디 칸에 적어","12","input_id"
"지금 주문내역 보고 있는데 지금 주문내역 페이지 보고 있는데, 쿠팡으로 이동해봐","5","go_coupang"
"지금 회원가입 화면인데 앱 다운로드 실행해봐","11","click_app_download"
"주문 자세히 보기 해줘","37","click_order_detail"
"일단 히어비 홈에 와 있어, 앱 다운로드 버튼 눌러?","11","click_app_download"
"지금 쇼핑 화면인데 이름 값 넣어","21","input_name"
"지금 메인 화면인데 쇼핑몰 이동 해봐","8","go_mall"
"지금 로그인 화면인데 현재 페이지 정보 및 가능한 작업 알려줘","6","read_current_page_actions"
"좀 아이디 찾기 해봐","17","click_find_id"
"일단 지금 주문 상세 조회 눌러 해줘","37","click_order_detail"
"일단 지금 로그인 페이지인데 히어브로 이동해줘","4","go_hearbe"
"지금 로그인 화면인데 체크 켜?","24","check_terms_agreement"
"바로그인 페이지에서 히어브 소개해줘","7","read_hearbe_guide"
"일단 로그인 페이지 화면에서 로그인 버튼 눌러 해","16","click_login"
"바로그인 페이지 화면에서 가입 화면 열어 해","19","click_signup"
"좀 아뒤 써?","12","input_id"
"바로그인 페이지인데 아이디 찾기 열어 해봐","17","click_find_id"
"지금 장바구니 보고 있는데 회원가입 페이지에서 이영약관 보기 눌러줘","22","click_view_terms"
"좀 회원탈퇴 들어가 해줄래?","36","click_delete_account"
"지금 로그인 화면인데 회원정보 페이지에서 비번 변경 시작해","35","click_change_password"
"일단 회원가입 제출해 가능?","25","submit_signup"
"지금가능한쇼핑몰요약해","29","read_available_marketplaces"
"바로 히어브 홈에 와 있어, 앱 다운로드 버튼 눌러줘 해줄래?","11","click_app_download"
"지금 바로 히어비로 열어 해줄래?","4","go_hearbe"
"지금 바로 주문 상세 조회 열어 해봐","37","click_order_detail"
"지금 메인 화면인데 지금 쇼핑몰 들어가","8","go_mall"
"점심 먹고 동네 한 바퀴 갈까?","0","unknown"
"주문내역 페이지 화면에서 주문 상세 화면으로 가줘 해","37","click_order_detail"
"바로 장바구니 담아줘 가능?","32","click_cart"
"퇴근하고 동네 한 바퀴 가서 바람 쐴까?","0","unknown"
"지금 좀 히어브 메인으로 가줘 해줄래?","4","go_hearbe"
"바로그인 페이지 화면에서 회원가입 시작해줘?","19","click_signup"
"좀 지금 회원정보 페이지인데 비밀번호 변경 메뉴로 가 해","35","click_change_password"
"일단 쿠팡 이동 들어가 해줘","31","click_go_coupang"
"지금 이영약관 동의 항목 체크해줘?","24","check_terms_agreement"
"지금화면읽어줘","23","read_terms"
"좀 주문내역 페이지 화면에서 가능한 명령어 읽어 해줘","6","read_current_page_actions"
"좀 지금 주문 상세 조회 들어가 해봐","37","click_order_detail"
"바로 탈퇴 메뉴 열어 해봐","36","click_delete_account"
"지금 비밀번호 값 넣어 해줄래?","13","input_password"
"지금 바로 지금 화면 읽어","34","read_page"
"좀 로그인 유지 체크 해제해줘","15","uncheck_keep_login"
"좀 지금 회원가입 페이지인데 아이디 칸에 적어줘 해","12","input_id"
"바로 지금 장바구니 페이지 보고 있는데, 상품조회 눌러 해줄래?","38","click_product_view"
"일단 쇼핑몰 페이지에서 장바구니 열어줘 해줄래?","32","click_cart"
"지금 쇼핑 화면인데 지금 비밀번호 확인 입력","27","input_password_confirm"
"지금 로그인 화면인데 쇼핑몰 페이지에서 쿠팡 화면 열어줘","31","click_go_coupang"
"오늘 헬스장 갈까?","0","unknown"
"지금 메인 화면인데 이용약관 동의 항목 체크해","24","check_terms_agreement"
"좀 지금 로그인 페이지인데 로긴 상태 유지로 바꿔줘","14","check_keep_login"
"로과웃 눌러줘 해","30","click_logout"
"내일 일기 쓰기 해볼래?","0","unknown"
"좀 히어비 메인 페이지 화면에서 히어비 서비스 설명해","7","read_hearbe_guide"
"지금 회원가입 화면인데 바로 가능한 쇼핑몰 요약해","29","read_available_marketplaces"
"좀 전화번호 적어 해","26","input_phone_number"
"이번 주말 설거지 하고 싶다","0","unknown"
"지금 장바구니 보고 있는데 로그인","16","click_login"
"지금 주문내역 보고 있는데 바로 체크 켜","14","check_keep_login"
"아무것도 하기 싫다","0","unknown"
"지금 메인 화면인데 회원가입 페이지 화면에서 회원가입 등록해줘","25","submit_signup"
"지금 메인 화면인데 장바구니 페이지에서 상품 페이지 보여","38","click_product_view"
"요즘 방 정리 해볼래?","0","unknown"
"지금 메인 화면인데 아뒤 입력해줘","12","input_id"
"지금 로그인 해","16","click_login"
"지금 장바구니 보고 있는데 상품조회 눌러","38","click_product_view"
"일단 좀 쿠팡으로 넘어가줘 해봐","5","go_coupang"
"일단 마이페이지 해봐","33","click_my_page"
"지금 장바구니 보고 있는데 바로 공유 쇼핑 입장 버튼 진행해","10","click_shared_shopping_entry"
"지금 주문내역 보고 있는데 지금 전화번호 작성해줘?","26","input_phone_number"
"바로 지금 내 정보 페이지 보여줘 해줄래?","33","click_my_page"
"일단 바로 비밀번호 찾기 열어 해","18","click_find_password"
"지금 장바구니 보고 있는데 로그인 페이지인데 로그인 상태 유지로 바꿔줘","14","check_keep_login"
"지금 쇼핑몰 페이지 보고 있는데, 가능한 쇼핑몰 읽어 해봐","29","read_available_marketplaces"
"지금 장바구니 보고 있는데 앱 다운로드 버튼 진행해","11","click_app_download"
"지금 회원가입 페이지에서 메일 주소 넣어","28","input_email"
"지금 주문내역 보고 있는데 쇼핑몰 들어가 해봐","8","go_mall"
"아이 디 중복 검사해줘?","20","click_check_id_duplicate"
"퇴근하고 동네 한 바퀴 갈까?","0","unknown"
"지금 주문내역 보고 있는데 희어비 홈 화면에서 쇼핑몰 화면 열어줘","8","go_mall"
"오늘 창문 열기 해야겠다","0","unknown"
"지금 로그인 화면인데 회원가 입으로 이동해줘","19","click_signup"
"바로 지금 상품조회?","38","click_product_view"
"지금 회원가입 화면인데 바로 체크 표시해","14","check_keep_login"
"앱 받기 해줘?","11","click_app_download"
"지금 회원가입 화면인데 공유 쇼핑 들어가주세요 해","10","click_shared_shopping_entry"
"바로 쇼핑몰 페이지 화면에서 내 정보 페이지 보여줘 해줄래?","33","click_my_page"
"지금 바로 공유 쇼핑 입장 버튼 해봐","10","click_shared_shopping_entry"
"지금 주문내역 보고 있는데 지금 이용 약관 읽어줘","23","read_terms"
"지금 쇼핑 화면인데 비밀 번호 변경 메뉴로 가줘","35","click_change_password"
"희어비로 이동해주세요 해줄래?","4","go_hearbe"
"지금 회원가입 화면인데 전화번호 넣어","26","input_phone_number"
"지금 로그인 화면인데 희어비 메인 페이지에서 쿠팡 접속해줘","5","go_coupang"
"내일 요리 할까?","0","unknown"
"퇴근하고 요리 할까?","0","unknown"
"좀 가능한 쇼핑몰 읽기 해","29","read_available_marketplaces"
"쿠팡 페이지로 넘어가 해봐","31","click_go_coupang"
"쇼핑몰 페이지 화면에서 쿠팡으로 이동해줘","31","click_go_coupang"
"좀 쿠팡 메인으로 가줘 해줘","5","go_coupang"
"지금 아이디 중복 확인해 해?","20","click_check_id_duplicate"
"지금 장바구니 보고 있는데 지금 로그인 페이지인데 로그인 실행해?","16","click_login"
"좀 지금 쇼핑몰 페이지 보고 있는데, 장바 구니 열어줘 해","32","click_cart"
"좀 쇼핑몰 페이지 화면에서 쿠팡이 화면 열어줘 해줄래?","31","click_go_coupang"
"지금 회원가입 화면인데 로그인 페이지에서 로그인 유지 선택 해제해","15","uncheck_keep_login"
